,number,value,datetime_start,datetime_complete,duration,params_C,params_dimensionality_reduction,params_gamma,params_kernel,params_n_clusters,params_n_components_LDA,params_n_components_PCA,params_n_features,params_normalization,params_probability,params_spatial_pyramid,params_step_size,state
108,108,0.8371809621942976,2023-01-15 14:54:10.256108,2023-01-15 14:56:10.770663,0 days 00:02:00.514555,0.11997679605240731,PCA,1.0714315384797701,linear,816,,60.0,228,l2,True,vertical 1x4,20,COMPLETE
109,109,0.834880798267901,2023-01-15 14:54:36.151223,2023-01-15 14:56:06.484619,0 days 00:01:30.333396,0.055341552062831145,PCA,0.9749267460996462,linear,820,,62.0,234,l2,True,vertical 1x4,20,COMPLETE
110,110,0.8295939967659667,2023-01-15 14:56:06.607012,2023-01-15 14:57:12.094520,0 days 00:01:05.487508,0.06174080981844424,PCA,1.1206800033174513,linear,874,,58.0,252,l2,True,vertical 1x4,19,COMPLETE
111,111,0.8427369017361818,2023-01-15 14:56:10.861465,2023-01-15 14:57:41.685453,0 days 00:01:30.823988,0.05611585744293209,PCA,0.9794264790780793,linear,822,,58.0,226,l2,True,vertical 1x4,19,COMPLETE
112,112,0.8294157382724414,2023-01-15 14:57:12.203489,2023-01-15 14:58:31.335233,0 days 00:01:19.131744,0.05833592044730238,PCA,0.9993498037614463,linear,871,,53.0,234,l2,True,vertical 1x4,19,COMPLETE
113,113,0.8300087410014518,2023-01-15 14:57:41.782928,2023-01-15 14:59:03.807857,0 days 00:01:22.024929,0.18615441086586124,PCA,0.5987535027451714,linear,816,,59.0,226,l2,True,vertical 1x4,19,COMPLETE
114,114,0.8253713938808284,2023-01-15 14:58:31.430851,2023-01-15 14:59:43.408633,0 days 00:01:11.977782,0.11249689986885106,PCA,0.3585170347193571,linear,814,,59.0,227,l2,True,vertical 1x4,18,COMPLETE
115,115,0.8274267126562558,2023-01-15 14:59:03.893081,2023-01-15 15:00:19.235472,0 days 00:01:15.342391,0.19783064097178224,PCA,0.6096019979912796,linear,818,,62.0,238,l2,True,vertical 1x4,18,COMPLETE
116,116,0.8207880128444023,2023-01-15 14:59:43.500943,2023-01-15 15:01:11.335043,0 days 00:01:27.834100,0.5970081422533051,PCA,0.7043889374177302,linear,759,,57.0,238,l2,True,vertical 1x4,20,COMPLETE
117,117,0.8291846904005628,2023-01-15 15:00:19.331087,2023-01-15 15:01:46.956373,0 days 00:01:27.625286,0.29058397225497773,PCA,0.2615130512032901,linear,824,,42.0,216,l2,True,vertical 1x4,20,COMPLETE
118,118,0.0,2023-01-15 15:01:11.428470,2023-01-15 15:03:02.613752,0 days 00:01:51.185282,0.07955216312987301,PCA,1.9272582725826946,histogram_intersection,751,,67.0,256,l2,True,vertical 1x4,20,COMPLETE
119,119,0.0,2023-01-15 15:01:47.050970,2023-01-15 15:02:37.561768,0 days 00:00:50.510798,0.07094728130708874,PCA,2.0447585418393848,histogram_intersection,718,,48.0,232,l2,True,vertical 1x4,17,COMPLETE
120,120,0.8270368566384999,2023-01-15 15:02:37.704264,2023-01-15 15:03:51.929747,0 days 00:01:14.225483,0.20723009601497894,PCA,0.5577490823197605,linear,794,,60.0,225,l2,True,vertical 1x4,19,COMPLETE
121,121,0.825379060784534,2023-01-15 15:03:02.706303,2023-01-15 15:04:22.047151,0 days 00:01:19.340848,0.17267826732716565,PCA,0.8619310274193623,linear,794,,54.0,225,l2,True,vertical 1x4,19,COMPLETE
122,122,0.8253882191690229,2023-01-15 15:03:52.012903,2023-01-15 15:05:22.048550,0 days 00:01:30.035647,0.04932495684307126,PCA,0.41010571373261556,linear,898,,64.0,228,l2,True,4x4,19,COMPLETE
123,123,0.8349676132240983,2023-01-15 15:04:22.141108,2023-01-15 15:05:51.828524,0 days 00:01:29.687416,0.05315112002042244,PCA,0.16984879246020648,linear,899,,56.0,206,l2,True,4x4,19,COMPLETE
124,124,0.8120127643640673,2023-01-15 15:05:22.199573,2023-01-15 15:06:46.948455,0 days 00:01:24.748882,0.44923950723848755,PCA,0.32362982692541525,linear,777,,70.0,205,l2,True,vertical 1x4,20,COMPLETE
125,125,0.842579603947369,2023-01-15 15:05:51.932871,2023-01-15 15:07:19.900309,0 days 00:01:27.967438,0.027312596320425042,PCA,0.09339149094812191,linear,858,,69.0,209,l2,True,vertical 1x4,20,COMPLETE
126,126,0.8174894468793654,2023-01-15 15:06:47.059410,2023-01-15 15:08:51.434429,0 days 00:02:04.375019,1.7278550408402238,PCA,0.2077105871811692,linear,921,,56.0,208,l2,True,vertical 1x4,20,COMPLETE
127,127,0.8379604244324812,2023-01-15 15:07:19.994873,2023-01-15 15:08:20.881574,0 days 00:01:00.886701,0.028543865659624967,PCA,0.07352187693321001,linear,858,,69.0,208,l2,True,vertical 1x4,18,COMPLETE
128,128,0.838294400849661,2023-01-15 15:08:21.061196,2023-01-15 15:09:36.380509,0 days 00:01:15.319313,0.02557216642779767,PCA,0.06934088233402254,linear,859,,66.0,202,l2,True,vertical 1x4,19,COMPLETE
129,129,0.8339728044434457,2023-01-15 15:08:51.518482,2023-01-15 15:10:29.644760,0 days 00:01:38.126278,0.027339482418292916,PCA,0.05420363100615167,linear,776,,72.0,194,l2,True,vertical 1x4,19,COMPLETE
130,130,0.8410494946023185,2023-01-15 15:09:36.468732,2023-01-15 15:10:51.602257,0 days 00:01:15.133525,0.02436944704143036,PCA,0.06344870612605726,linear,851,,72.0,194,l2,True,vertical 1x4,18,COMPLETE
131,131,0.0,2023-01-15 15:10:29.788904,2023-01-15 15:10:50.802287,0 days 00:00:21.013383,0.09727683179525252,PCA,0.07958715460052285,linear,858,,66.0,186,l2,True,vertical 1x4,1,COMPLETE
132,132,0.8388105554342683,2023-01-15 15:10:50.913063,2023-01-15 15:12:21.455629,0 days 00:01:30.542566,0.027639486581432574,PCA,0.024368219233891035,linear,857,,69.0,178,l2,True,vertical 1x4,19,COMPLETE
133,133,0.8378398051563541,2023-01-15 15:10:51.696697,2023-01-15 15:11:54.365095,0 days 00:01:02.668398,0.028893451583378818,PCA,0.025991762459509894,linear,780,,68.0,172,l2,True,vertical 1x4,17,COMPLETE
134,134,0.8340264509381086,2023-01-15 15:11:54.541874,2023-01-15 15:13:27.098007,0 days 00:01:32.556133,0.02781769318630147,PCA,0.0336249128506273,linear,690,,72.0,172,l2,True,vertical 1x4,17,COMPLETE
135,135,0.8398588112435317,2023-01-15 15:12:21.549127,2023-01-15 15:13:30.439228,0 days 00:01:08.890101,0.029756366032075158,PCA,0.026955269404123558,linear,773,,72.0,175,l2,True,vertical 1x4,17,COMPLETE
136,136,0.8282543984669862,2023-01-15 15:13:27.221120,2023-01-15 15:14:20.444323,0 days 00:00:53.223203,0.028713999474739082,PCA,0.024028319566203687,linear,724,,73.0,173,l2,True,vertical 1x4,17,COMPLETE
137,137,0.8315168486779886,2023-01-15 15:13:30.531618,2023-01-15 15:14:40.789851,0 days 00:01:10.258233,0.027692426317491865,PCA,0.027114860942448162,linear,699,,72.0,174,l2,True,vertical 1x4,16,COMPLETE
138,138,0.8316221572491005,2023-01-15 15:14:20.566410,2023-01-15 15:15:25.317084,0 days 00:01:04.750674,0.016146321089516524,PCA,0.0383029500711977,linear,776,,71.0,173,l2,True,vertical 1x4,15,COMPLETE
139,139,0.39894629893042854,2023-01-15 15:14:40.877355,2023-01-15 15:15:57.219286,0 days 00:01:16.341931,0.016712450210665575,LDA,0.04455963481944805,linear,787,2.0,,166,l2,True,vertical 1x4,17,COMPLETE
140,140,0.7122272148661766,2023-01-15 15:15:25.479459,2023-01-15 15:16:42.558394,0 days 00:01:17.078935,0.034641727653866534,LDA,0.06952935204070355,linear,852,7.0,,158,l2,True,vertical 1x4,16,COMPLETE
141,141,0.8390068012694758,2023-01-15 15:15:57.310247,2023-01-15 15:17:07.833288,0 days 00:01:10.523041,0.03690510143123417,PCA,0.006293054802077315,linear,837,,70.0,177,l2,True,vertical 1x4,17,COMPLETE
142,142,0.840641114004051,2023-01-15 15:16:42.717975,2023-01-15 15:18:18.141075,0 days 00:01:35.423100,0.027088154453959123,PCA,0.01446267296192817,linear,827,,69.0,193,l2,True,vertical 1x4,18,COMPLETE
143,143,0.8319720763188914,2023-01-15 15:17:07.927483,2023-01-15 15:18:19.438879,0 days 00:01:11.511396,0.06168327622002788,PCA,0.005985330934487427,linear,822,,69.0,192,l2,True,vertical 1x4,16,COMPLETE
144,144,0.8465358873308846,2023-01-15 15:18:18.242297,2023-01-15 15:19:40.384515,0 days 00:01:22.142218,0.05301028886684991,PCA,0.0077250208896596975,linear,829,,69.0,176,l2,True,vertical 1x4,17,COMPLETE
145,145,0.8340498034913525,2023-01-15 15:18:19.532167,2023-01-15 15:19:12.957878,0 days 00:00:53.425711,0.04542810194494418,PCA,0.01090591024811943,linear,688,,68.0,179,l2,True,vertical 1x4,17,COMPLETE
146,146,0.8475130221121848,2023-01-15 15:19:13.268981,2023-01-15 15:20:27.835652,0 days 00:01:14.566671,0.048551793416182196,PCA,0.008878377073825069,linear,835,,65.0,178,l2,True,vertical 1x4,18,COMPLETE
147,147,0.8373849803758715,2023-01-15 15:19:40.480530,2023-01-15 15:20:57.487427,0 days 00:01:17.006897,0.05475781756893838,PCA,0.014415076708193378,linear,838,,76.0,178,l2,True,vertical 1x4,18,COMPLETE
148,148,0.12602083333333333,2023-01-15 15:20:27.918934,2023-01-15 15:21:34.481794,0 days 00:01:06.562860,0.07984831732045607,PCA,0.0023147014836265773,RBF,841,,76.0,178,l2,True,vertical 1x4,15,COMPLETE
149,149,0.22143226067410846,2023-01-15 15:20:57.587628,2023-01-15 15:22:11.186992,0 days 00:01:13.599364,0.08616466865711452,PCA,0.002924859527811773,RBF,841,,70.0,177,l2,True,vertical 1x4,15,COMPLETE
150,150,0.831289000668094,2023-01-15 15:21:34.569608,2023-01-15 15:22:45.490378,0 days 00:01:10.920770,0.03749256746395512,PCA,0.006700708326871615,linear,861,,74.0,170,l2,True,vertical 1x4,18,COMPLETE
151,151,0.8380721725981086,2023-01-15 15:22:11.278439,2023-01-15 15:23:26.268321,0 days 00:01:14.989882,0.037228290609815674,PCA,0.014956042660617336,linear,804,,65.0,167,l2,True,vertical 1x4,18,COMPLETE
152,152,0.83457129144495,2023-01-15 15:22:45.585021,2023-01-15 15:24:03.092966,0 days 00:01:17.507945,0.023496038606903788,PCA,0.01665979892311846,linear,809,,65.0,187,l2,True,vertical 1x4,18,COMPLETE
153,153,0.836152289422835,2023-01-15 15:23:26.368886,2023-01-15 15:24:41.019776,0 days 00:01:14.650890,0.021851849101138972,PCA,0.014616629896348193,linear,804,,67.0,184,l2,True,vertical 1x4,18,COMPLETE
154,154,0.8385432801858224,2023-01-15 15:24:03.197039,2023-01-15 15:25:15.077313,0 days 00:01:11.880274,0.03509126857667814,PCA,0.013094255554299567,linear,747,,70.0,182,l2,True,vertical 1x4,17,COMPLETE
155,155,0.8307731866382738,2023-01-15 15:24:41.109895,2023-01-15 15:25:50.462337,0 days 00:01:09.352442,0.03461873487708635,PCA,0.020570927525719786,linear,755,,69.0,166,l2,True,vertical 1x4,17,COMPLETE
156,156,0.8356376770170615,2023-01-15 15:25:15.173072,2023-01-15 15:26:34.313121,0 days 00:01:19.140049,0.038189344420848204,PCA,0.010817780996331586,linear,749,,65.0,167,l2,True,vertical 1x4,17,COMPLETE
157,157,0.832485711163535,2023-01-15 15:25:50.550769,2023-01-15 15:27:01.759334,0 days 00:01:11.208565,0.014395458895498503,PCA,0.008096706192405186,linear,878,,66.0,182,l2,True,vertical 1x4,17,COMPLETE
158,158,0.8330034256213684,2023-01-15 15:26:34.456256,2023-01-15 15:27:51.270838,0 days 00:01:16.814582,0.013491488674467509,PCA,0.008896487107153716,linear,867,,70.0,183,l2,True,vertical 1x4,18,COMPLETE
159,159,0.8364413174238197,2023-01-15 15:27:01.851443,2023-01-15 15:28:19.940629,0 days 00:01:18.089186,0.018656179430934512,PCA,0.004472865380358825,linear,835,,74.0,156,l2,True,vertical 1x4,18,COMPLETE
160,160,0.7839961458160976,2023-01-15 15:27:51.368283,2023-01-15 15:29:02.916374,0 days 00:01:11.548091,8.346400923750075,PCA,0.004699832283706522,linear,795,,68.0,161,l2,True,horizontal 3x1,18,COMPLETE
161,161,0.8257362549867826,2023-01-15 15:28:20.036300,2023-01-15 15:29:17.519746,0 days 00:00:57.483446,0.04717140009345081,PCA,0.017644050070809752,linear,490,,74.0,161,l2,True,vertical 1x4,16,COMPLETE
162,162,0.8332369368955961,2023-01-15 15:29:03.007316,2023-01-15 15:30:07.022021,0 days 00:01:04.014705,0.020174885765564966,PCA,0.09491036920133447,linear,833,,76.0,159,l2,True,vertical 1x4,18,COMPLETE
163,163,0.8379846201651615,2023-01-15 15:29:17.605746,2023-01-15 15:30:42.906193,0 days 00:01:25.300447,0.018613381135505598,PCA,0.09570308639837569,linear,839,,71.0,155,l2,True,vertical 1x4,18,COMPLETE
164,164,0.8295012341268112,2023-01-15 15:30:07.120121,2023-01-15 15:31:22.604721,0 days 00:01:15.484600,0.028622143737791605,PCA,0.03149086413017585,linear,853,,70.0,176,l2,True,vertical 1x4,17,COMPLETE
165,165,0.8252847252795863,2023-01-15 15:30:43.007672,2023-01-15 15:31:58.191611,0 days 00:01:15.183939,0.02908872687514363,PCA,0.02419761762955581,linear,854,,68.0,150,l2,True,vertical 1x4,17,COMPLETE
166,166,0.8294482013948595,2023-01-15 15:31:22.693554,2023-01-15 15:32:33.713010,0 days 00:01:11.019456,0.034642709298838587,PCA,0.0530395627408987,linear,771,,72.0,169,l2,True,2x2,18,COMPLETE
167,167,0.8356560505380536,2023-01-15 15:31:58.279444,2023-01-15 15:33:15.760036,0 days 00:01:17.480592,0.06702189447097841,PCA,0.049575430056163376,linear,770,,61.0,201,l2,True,vertical 1x4,18,COMPLETE
168,168,0.8288859188985394,2023-01-15 15:32:33.805060,2023-01-15 15:33:46.657205,0 days 00:01:12.852145,0.04700338192675917,PCA,0.1171775079865885,linear,807,,65.0,189,l2,True,vertical 1x4,18,COMPLETE
169,169,0.8126743785768532,2023-01-15 15:33:15.852724,2023-01-15 15:34:06.997229,0 days 00:00:51.144505,0.052037811906410575,PCA,0.109704318713564,linear,807,,67.0,188,l2,True,vertical 1x4,9,COMPLETE
170,170,0.8223655374096912,2023-01-15 15:33:46.745082,2023-01-15 15:35:20.898594,0 days 00:01:34.153512,0.023060566384345133,PCA,0.012494242002404718,linear,729,,78.0,181,l2,True,horizontal 4x1,17,COMPLETE
171,171,0.8193270507926321,2023-01-15 15:34:07.096104,2023-01-15 15:35:24.794797,0 days 00:01:17.698693,0.025102459451099964,PCA,0.012618910010343825,linear,889,,71.0,180,l2,True,horizontal 4x1,17,COMPLETE
172,172,0.8259206694028857,2023-01-15 15:35:21.036265,2023-01-15 15:36:48.709146,0 days 00:01:27.672881,0.017958624668034672,PCA,0.005765533342407247,linear,828,,74.0,154,l2,True,vertical 1x4,18,COMPLETE
173,173,0.8380128970465563,2023-01-15 15:35:24.890704,2023-01-15 15:36:52.110400,0 days 00:01:27.219696,0.01853715879743982,PCA,0.004805257722274079,linear,819,,74.0,154,l2,True,vertical 1x4,18,COMPLETE
174,174,0.8301654751743474,2023-01-15 15:36:48.823542,2023-01-15 15:38:23.756698,0 days 00:01:34.933156,0.011417948337522184,PCA,0.0194781441525991,linear,839,,69.0,193,l2,True,vertical 1x4,18,COMPLETE
175,175,0.8296554528170612,2023-01-15 15:36:52.196515,2023-01-15 15:37:57.863754,0 days 00:01:05.667239,0.011366119716223817,PCA,0.00793203891377529,linear,877,,69.0,134,l2,True,vertical 1x4,18,COMPLETE
176,176,0.0,2023-01-15 15:37:58.042250,2023-01-15 15:39:10.203285,0 days 00:01:12.161035,0.04265826132239811,PCA,0.020192197133190933,histogram_intersection,824,,64.0,193,l2,True,vertical 1x3,17,COMPLETE
177,177,0.0,2023-01-15 15:38:23.860307,2023-01-15 15:39:34.792987,0 days 00:01:10.932680,0.0354649631835492,PCA,0.0037578001931105423,histogram_intersection,788,,64.0,145,l2,True,vertical 1x3,17,COMPLETE
178,178,0.8300476186222705,2023-01-15 15:39:10.380959,2023-01-15 15:40:12.765728,0 days 00:01:02.384769,0.03583804187889475,PCA,0.07761892446187084,linear,788,,72.0,176,l2,True,vertical 1x4,16,COMPLETE
179,179,0.8229174934616967,2023-01-15 15:39:34.886345,2023-01-15 15:40:40.217325,0 days 00:01:05.330980,0.06271978863125346,PCA,0.06765136043242809,linear,854,,77.0,163,l2,True,vertical 1x4,16,COMPLETE
180,180,0.8404633101030807,2023-01-15 15:40:12.857780,2023-01-15 15:41:27.123466,0 days 00:01:14.265686,0.07230789722523427,PCA,0.008906705496504165,linear,856,,67.0,164,l2,True,vertical 1x4,19,COMPLETE
181,181,0.8436619250325851,2023-01-15 15:40:40.311416,2023-01-15 15:42:21.560401,0 days 00:01:41.248985,0.015544495065902877,PCA,0.00913910458394217,linear,808,,67.0,170,l2,True,vertical 1x4,19,COMPLETE
182,182,0.8345030323605789,2023-01-15 15:41:27.224424,2023-01-15 15:42:45.709834,0 days 00:01:18.485410,0.08912497576041588,PCA,0.01004981952758509,linear,870,,67.0,171,l2,True,vertical 1x4,19,COMPLETE
183,183,0.7936185025772338,2023-01-15 15:42:21.709204,2023-01-15 15:43:41.335113,0 days 00:01:19.625909,0.016245211018114512,PCA,0.009954446782883935,linear,864,,12.0,170,l2,True,vertical 1x4,19,COMPLETE
184,184,0.8324430521454312,2023-01-15 15:42:45.798031,2023-01-15 15:44:05.710183,0 days 00:01:19.912152,0.016766562162237823,PCA,0.00701047297703212,linear,804,,71.0,164,l2,True,vertical 1x4,18,COMPLETE
185,185,0.8312589402928756,2023-01-15 15:43:41.532686,2023-01-15 15:44:51.907427,0 days 00:01:10.374741,0.0220358199335356,PCA,0.006834932518038304,linear,807,,66.0,165,l2,True,vertical 1x4,18,COMPLETE
186,186,0.8397063057206127,2023-01-15 15:44:05.807778,2023-01-15 15:45:25.280856,0 days 00:01:19.473078,0.021624995049196048,PCA,0.014024271726276145,linear,829,,75.0,152,l2,True,vertical 1x4,18,COMPLETE
187,187,0.8369858317862688,2023-01-15 15:44:51.989493,2023-01-15 15:46:11.870199,0 days 00:01:19.880706,0.02700868026745016,PCA,0.028640848120613804,linear,839,,73.0,175,l2,True,vertical 1x4,19,COMPLETE
188,188,0.8253451974818364,2023-01-15 15:45:25.380630,2023-01-15 15:46:31.184002,0 days 00:01:05.803372,0.026936933495892212,PCA,0.027975255432137677,linear,306,,69.0,151,l2,True,vertical 1x4,19,COMPLETE
189,189,0.2830567062248096,2023-01-15 15:46:11.971001,2023-01-15 15:47:29.617409,0 days 00:01:17.646408,0.021307139219247793,LDA,0.005350377119973415,linear,885,1.0,,153,l2,True,vertical 1x4,17,COMPLETE
190,190,0.29721771005687103,2023-01-15 15:46:31.291808,2023-01-15 15:48:04.234828,0 days 00:01:32.943020,75.23130926701637,LDA,0.0021627922217250612,linear,891,1.0,,157,power,True,vertical 1x4,17,COMPLETE
191,191,0.8376560979756453,2023-01-15 15:47:29.842997,2023-01-15 15:48:57.014672,0 days 00:01:27.171675,0.015033900033198266,PCA,0.0028001896383794815,linear,748,,76.0,198,power,True,vertical 1x4,19,COMPLETE
192,192,0.8349767135241422,2023-01-15 15:48:04.324181,2023-01-15 15:49:20.187658,0 days 00:01:15.863477,0.04516684379137976,PCA,0.015368044195918374,linear,829,,75.0,179,l2,True,vertical 1x4,18,COMPLETE
193,193,0.8451857214368262,2023-01-15 15:48:57.172003,2023-01-15 15:50:21.260334,0 days 00:01:24.088331,0.015477623814908503,PCA,0.0034810861245215615,linear,822,,79.0,146,power,True,vertical 1x4,19,COMPLETE
194,194,0.8379721009349155,2023-01-15 15:49:20.284177,2023-01-15 15:50:42.452323,0 days 00:01:22.168146,0.013720142730617862,PCA,0.0012533440230367515,linear,771,,79.0,147,power,True,vertical 1x4,19,COMPLETE
195,195,0.8424702956453973,2023-01-15 15:50:21.393075,2023-01-15 15:51:32.221272,0 days 00:01:10.828197,0.012815071216936357,PCA,0.0033794037704275863,linear,771,,71.0,146,power,True,vertical 1x4,19,COMPLETE
196,196,0.8410422486470235,2023-01-15 15:50:42.554522,2023-01-15 15:52:07.060765,0 days 00:01:24.506243,0.009346879686541886,PCA,0.0018062123667429042,linear,851,,79.0,144,power,True,vertical 1x4,19,COMPLETE
197,197,0.0,2023-01-15 15:51:32.313798,2023-01-15 15:52:06.967506,0 days 00:00:34.653708,0.010435824052649059,PCA,0.0013963330129263235,linear,768,,79.0,142,power,True,vertical 1x4,2,COMPLETE
198,198,0.8329620143269979,2023-01-15 15:52:07.059630,2023-01-15 15:53:34.175450,0 days 00:01:27.115820,0.007920909104433466,PCA,0.0018997565882505382,linear,819,,73.0,149,power,True,horizontal 3x1,19,COMPLETE
199,199,0.8364165393987506,2023-01-15 15:52:07.155238,2023-01-15 15:53:13.590326,0 days 00:01:06.435088,0.009216298379911333,PCA,0.001895232074692448,linear,819,,72.0,138,power,True,horizontal 3x1,19,COMPLETE
