,number,value,datetime_start,datetime_complete,duration,params_C,params_dimensionality_reduction,params_gamma,params_kernel,params_n_clusters,params_n_components_LDA,params_n_components_PCA,params_n_features,params_normalization,params_probability,params_spatial_pyramid,params_step_size,state
0,0,0.0,2023-01-15 13:46:58.685355,2023-01-15 13:47:07.662847,0 days 00:00:08.977492,0.34512953740701924,LDA,0.019425108029506304,RBF,140,6.0,,140,l2,True,horizontal 4x1,1,COMPLETE
1,1,0.0,2023-01-15 13:46:58.721176,2023-01-15 13:47:30.020863,0 days 00:00:31.299687,0.011778750917183195,LDA,3.1009180736418767,histogram_intersection,453,7.0,,240,none,False,1x1,11,COMPLETE
2,2,0.0,2023-01-15 13:47:07.778962,2023-01-15 13:47:43.096176,0 days 00:00:35.317214,475.360791029843,PCA,3.036335671200496,histogram_intersection,502,,83.0,139,none,False,2x2,3,COMPLETE
3,3,0.19451214824359994,2023-01-15 13:47:30.097136,2023-01-15 13:49:04.313328,0 days 00:01:34.216192,14.938826450727923,LDA,105.23424333746465,RBF,662,1.0,,192,power,True,vertical 1x3,19,COMPLETE
4,4,0.0,2023-01-15 13:47:43.195279,2023-01-15 13:48:57.162900,0 days 00:01:13.967621,11.294643007981625,LDA,0.02767351941115863,histogram_intersection,916,6.0,,135,power,False,4x4,3,COMPLETE
5,5,0.12596153846153846,2023-01-15 13:48:57.273077,2023-01-15 13:49:24.405328,0 days 00:00:27.132251,1.0296017158119006,LDA,712.1807471049353,RBF,178,7.0,,279,none,True,horizontal 4x1,10,COMPLETE
6,6,0.0,2023-01-15 13:49:04.400249,2023-01-15 13:49:51.323240,0 days 00:00:46.922991,0.4031529433423548,LDA,0.004837585404487634,histogram_intersection,84,3.0,,241,none,False,vertical 1x2,16,COMPLETE
7,7,0.43156793431072904,2023-01-15 13:49:24.508546,2023-01-15 13:50:23.741517,0 days 00:00:59.232971,0.020680280741742135,LDA,0.003607378057914366,linear,529,3.0,,225,none,True,2x2,19,COMPLETE
8,8,0.0,2023-01-15 13:49:51.413117,2023-01-15 13:50:39.712150,0 days 00:00:48.299033,0.8245833326410593,PCA,0.12602957379700594,histogram_intersection,853,,81.0,245,power,True,horizontal 2x1,8,COMPLETE
9,9,0.0,2023-01-15 13:50:24.163498,2023-01-15 13:50:40.922457,0 days 00:00:16.758959,0.006393673851171416,LDA,0.011192142181436398,RBF,496,1.0,,202,l2,True,4x4,1,COMPLETE
10,10,0.0,2023-01-15 13:50:39.800063,2023-01-15 13:51:33.058745,0 days 00:00:53.258682,320.9269749784517,LDA,0.0015654212265200755,histogram_intersection,372,3.0,,165,power,False,2x2,19,COMPLETE
11,11,0.2251402792921721,2023-01-15 13:50:41.022638,2023-01-15 13:51:56.209300,0 days 00:01:15.186662,0.0012870827707358965,PCA,0.0012164553031571831,linear,301,,2.0,191,none,True,vertical 1x3,20,COMPLETE
12,12,0.41017248964803316,2023-01-15 13:51:33.143528,2023-01-15 13:53:10.984477,0 days 00:01:37.840949,0.0010725082566745178,PCA,184.8986494012307,linear,709,,4.0,195,power,True,vertical 1x4,20,COMPLETE
13,13,0.5640010858930955,2023-01-15 13:51:56.315158,2023-01-15 13:52:28.210485,0 days 00:00:31.895327,0.001385183442381783,PCA,0.0013894188710239057,linear,284,,8.0,201,none,True,vertical 1x3,15,COMPLETE
14,14,0.7274098738494205,2023-01-15 13:52:28.296948,2023-01-15 13:53:25.317634,0 days 00:00:57.020686,0.032351624977523,PCA,0.26729295359058564,linear,703,,5.0,217,none,True,vertical 1x4,15,COMPLETE
15,15,0.8059581309314453,2023-01-15 13:53:11.148554,2023-01-15 13:54:06.892883,0 days 00:00:55.744329,0.03237846551621967,PCA,0.23395635042466478,linear,668,,34.0,291,none,True,horizontal 3x1,15,COMPLETE
16,16,0.8067795493946859,2023-01-15 13:53:25.405756,2023-01-15 13:54:26.387112,0 days 00:01:00.981356,0.058655687864247484,PCA,0.2953442345485737,linear,701,,33.0,101,none,True,horizontal 3x1,15,COMPLETE
17,17,0.819856721107303,2023-01-15 13:54:07.099992,2023-01-15 13:55:10.826505,0 days 00:01:03.726513,0.06154718602656037,PCA,0.4841801966453998,linear,1016,,41.0,299,l2,True,horizontal 3x1,14,COMPLETE
18,18,0.8080925555086174,2023-01-15 13:54:26.479675,2023-01-15 13:55:30.974743,0 days 00:01:04.495068,0.09804028098808473,PCA,0.8305283387046951,linear,801,,44.0,112,l2,True,horizontal 3x1,12,COMPLETE
19,19,0.8090144383084541,2023-01-15 13:55:11.042502,2023-01-15 13:56:12.514787,0 days 00:01:01.472285,0.14036532276678715,PCA,9.317936461015991,linear,1010,,55.0,110,l2,True,horizontal 3x1,11,COMPLETE
20,20,0.7908524961814535,2023-01-15 13:55:31.063605,2023-01-15 13:56:39.770514,0 days 00:01:08.706909,0.1849539465837491,PCA,15.370385092194212,linear,981,,58.0,102,l2,True,horizontal 3x1,12,COMPLETE
21,21,0.7720894704836402,2023-01-15 13:56:12.767894,2023-01-15 13:57:15.314993,0 days 00:01:02.547099,6.041197585338545,PCA,30.759386536209078,linear,1016,,56.0,269,l2,True,horizontal 3x1,7,COMPLETE
22,22,0.8025895993106203,2023-01-15 13:56:40.062442,2023-01-15 13:57:36.598531,0 days 00:00:56.536089,0.0887763215624445,PCA,2.0573120696735714,linear,1017,,54.0,114,l2,True,horizontal 3x1,8,COMPLETE
23,23,0.8046081005462268,2023-01-15 13:57:15.684573,2023-01-15 13:58:20.809932,0 days 00:01:05.125359,0.09227040313844151,PCA,1.039958385676754,linear,879,,37.0,118,l2,True,horizontal 3x1,13,COMPLETE
24,24,0.8010639900257296,2023-01-15 13:57:36.687782,2023-01-15 13:58:43.201887,0 days 00:01:06.514105,1.624857862032204,PCA,9.945077522095017,linear,936,,37.0,165,l2,True,horizontal 3x1,13,COMPLETE
25,25,0.7812522781003508,2023-01-15 13:58:20.947659,2023-01-15 13:59:22.942293,0 days 00:01:01.994634,2.573137293677861,PCA,10.311320897219485,linear,807,,72.0,153,l2,True,horizontal 2x1,13,COMPLETE
26,26,0.8001047288122024,2023-01-15 13:58:43.285880,2023-01-15 13:59:38.031528,0 days 00:00:54.745648,0.006933904759716198,PCA,0.10618748089427317,linear,803,,69.0,160,l2,True,horizontal 2x1,10,COMPLETE
27,27,0.809420830761644,2023-01-15 13:59:23.107179,2023-01-15 14:00:39.007047,0 days 00:01:15.899868,0.0059549605388982355,PCA,0.05804991342577071,linear,775,,99.0,124,l2,False,1x1,10,COMPLETE
28,28,0.7898958870909376,2023-01-15 13:59:38.130065,2023-01-15 14:00:39.636822,0 days 00:01:01.506757,46.01368848271735,PCA,0.6099809836471144,linear,817,,21.0,124,l2,False,1x1,17,COMPLETE
29,29,0.7610528746265353,2023-01-15 14:00:39.098892,2023-01-15 14:01:10.165571,0 days 00:00:31.066679,0.0031533235311380988,PCA,0.05569955693210822,linear,597,,99.0,127,l2,False,1x1,6,COMPLETE
30,30,0.125,2023-01-15 14:00:39.715062,2023-01-15 14:01:20.242542,0 days 00:00:40.527480,0.002993742404256106,PCA,0.0410667656786288,RBF,615,,21.0,181,l2,False,1x1,7,COMPLETE
31,31,0.7825538178608831,2023-01-15 14:01:10.418020,2023-01-15 14:02:04.558385,0 days 00:00:54.140365,0.3651057767531429,PCA,0.040037708630673186,RBF,938,,45.0,181,l2,False,vertical 1x2,9,COMPLETE
32,32,0.8073256867713636,2023-01-15 14:01:20.325765,2023-01-15 14:02:24.442857,0 days 00:01:04.117092,0.17020342178673148,PCA,0.7443635232724553,linear,945,,46.0,111,l2,False,vertical 1x2,11,COMPLETE
33,33,0.7960410050251395,2023-01-15 14:02:04.745062,2023-01-15 14:02:53.455401,0 days 00:00:48.710339,0.18008379252462106,PCA,0.7497566862241021,linear,762,,64.0,150,l2,False,horizontal 4x1,11,COMPLETE
34,34,0.8138028904257452,2023-01-15 14:02:24.532920,2023-01-15 14:03:20.593187,0 days 00:00:56.060267,0.024358375024707928,PCA,4.39649346580659,linear,766,,99.0,143,l2,False,horizontal 3x1,12,COMPLETE
35,35,0.8104892439930069,2023-01-15 14:02:53.540338,2023-01-15 14:03:52.337136,0 days 00:00:58.796798,0.02001800085179541,PCA,4.511807600153973,linear,887,,99.0,256,l2,True,1x1,12,COMPLETE
36,36,0.8124738845951562,2023-01-15 14:03:20.674756,2023-01-15 14:04:18.789628,0 days 00:00:58.114872,0.013612538261076548,PCA,2.862171905016161,linear,865,,97.0,140,l2,False,1x1,12,COMPLETE
37,37,0.8168846036620735,2023-01-15 14:03:52.421097,2023-01-15 14:04:59.477720,0 days 00:01:07.056623,0.01376977895435547,PCA,3.186863767543667,linear,890,,89.0,259,l2,False,1x1,14,COMPLETE
38,38,0.0,2023-01-15 14:04:18.875571,2023-01-15 14:05:28.871731,0 days 00:01:09.996160,0.015325695095434548,PCA,2.6031392283288644,histogram_intersection,880,,91.0,257,l2,False,1x1,17,COMPLETE
39,39,0.0,2023-01-15 14:04:59.563206,2023-01-15 14:06:00.091631,0 days 00:01:00.528425,0.020377092979706246,LDA,50.53712332062398,histogram_intersection,857,5.0,,300,l2,False,1x1,14,COMPLETE
40,40,0.12811223474801064,2023-01-15 14:05:28.959094,2023-01-15 14:07:35.951027,0 days 00:02:06.991933,0.04784702669889194,LDA,33.95333786123861,RBF,966,4.0,,296,power,False,4x4,14,COMPLETE
41,41,0.3075640185930616,2023-01-15 14:06:00.175856,2023-01-15 14:07:36.150038,0 days 00:01:35.974182,0.04366953441321554,LDA,4.788004958774019,RBF,960,4.0,,280,power,False,horizontal 4x1,14,COMPLETE
42,42,0.8044477778724601,2023-01-15 14:07:36.039600,2023-01-15 14:08:44.812876,0 days 00:01:08.773276,0.012046921583352046,PCA,3.737013598899564,linear,874,,91.0,280,l2,False,1x1,12,COMPLETE
43,43,0.8151647324538216,2023-01-15 14:07:36.246972,2023-01-15 14:08:43.671646,0 days 00:01:07.424674,0.011467731368067237,PCA,4.338912202452397,linear,890,,89.0,229,l2,False,1x1,12,COMPLETE
44,44,0.8158294764878544,2023-01-15 14:08:43.798077,2023-01-15 14:10:08.841933,0 days 00:01:25.043856,0.012203964009199939,PCA,1.6288832719040671,linear,918,,78.0,217,l2,False,1x1,17,COMPLETE
45,45,0.8108339352180343,2023-01-15 14:08:44.908148,2023-01-15 14:09:36.628181,0 days 00:00:51.720033,0.00322241764995751,PCA,1.4899588018432501,linear,738,,86.0,229,l2,False,2x2,17,COMPLETE
46,46,0.8363689379218062,2023-01-15 14:09:36.716694,2023-01-15 14:10:58.312140,0 days 00:01:21.595446,0.008896249090025411,PCA,6.048522392197206,linear,833,,79.0,233,l2,False,vertical 1x4,16,COMPLETE
47,47,0.8297381210546207,2023-01-15 14:10:08.933304,2023-01-15 14:11:26.754136,0 days 00:01:17.820832,0.004251021143907643,PCA,0.4059278075118889,linear,915,,76.0,223,l2,False,vertical 1x4,18,COMPLETE
48,48,0.0,2023-01-15 14:10:58.494641,2023-01-15 14:12:16.626869,0 days 00:01:18.132228,0.007888763358176253,PCA,0.418228398064771,histogram_intersection,922,,78.0,218,l2,False,vertical 1x4,18,COMPLETE
49,49,0.0,2023-01-15 14:11:26.843804,2023-01-15 14:12:49.287112,0 days 00:01:22.443308,0.006399488685812362,PCA,0.46418788610135564,histogram_intersection,914,,81.0,215,power,False,vertical 1x4,18,COMPLETE
50,50,0.399071342138621,2023-01-15 14:12:16.708695,2023-01-15 14:13:10.276510,0 days 00:00:53.567815,0.004194886986748471,LDA,0.13813354187778798,linear,37,2.0,,248,power,False,vertical 1x4,18,COMPLETE
51,51,0.6235653565142389,2023-01-15 14:12:49.397647,2023-01-15 14:13:36.098825,0 days 00:00:46.701178,0.002136536311975254,LDA,0.13344616392630007,linear,28,5.0,,244,l2,False,vertical 1x4,16,COMPLETE
52,52,0.7957126059119125,2023-01-15 14:13:10.364749,2023-01-15 14:14:10.717706,0 days 00:01:00.352957,0.002022769273672,PCA,1.2961768770309072,linear,834,,75.0,230,l2,False,vertical 1x4,16,COMPLETE
53,53,0.788405342955045,2023-01-15 14:13:36.172852,2023-01-15 14:14:41.613567,0 days 00:01:05.440715,0.0016059390039176442,PCA,15.537335477588638,linear,834,,87.0,231,l2,False,vertical 1x3,16,COMPLETE
54,54,0.8197757304101598,2023-01-15 14:14:10.819676,2023-01-15 14:15:23.742949,0 days 00:01:12.923273,0.010041199317378376,PCA,6.760085763861099,linear,997,,66.0,209,l2,False,4x4,16,COMPLETE
55,55,0.8320752288340468,2023-01-15 14:14:41.695438,2023-01-15 14:16:09.364307,0 days 00:01:27.668869,0.0107009850494468,PCA,1.723240277517656,linear,984,,66.0,208,l2,False,vertical 1x4,19,COMPLETE
56,56,0.8286564388687406,2023-01-15 14:15:23.842159,2023-01-15 14:17:01.030298,0 days 00:01:37.188139,0.033228099931094206,PCA,327.9058738836857,linear,985,,66.0,212,none,False,4x4,19,COMPLETE
57,57,0.8258083145817551,2023-01-15 14:16:09.452181,2023-01-15 14:17:50.146238,0 days 00:01:40.694057,0.005234806874368705,PCA,203.02853189539601,linear,997,,65.0,264,none,False,4x4,20,COMPLETE
58,58,0.8174307442357087,2023-01-15 14:17:01.130850,2023-01-15 14:18:44.342747,0 days 00:01:43.211897,0.6355130660627285,PCA,556.5313928720386,linear,1000,,65.0,205,none,False,4x4,20,COMPLETE
59,59,0.8212094125067967,2023-01-15 14:17:50.246655,2023-01-15 14:19:38.893946,0 days 00:01:48.647291,0.004553953782490247,PCA,355.93028265470815,linear,1024,,61.0,269,none,False,4x4,20,COMPLETE
60,60,0.7407879257234826,2023-01-15 14:18:44.432251,2023-01-15 14:19:51.058342,0 days 00:01:06.626091,0.001080336533791658,PCA,232.8053757417894,linear,168,,61.0,237,none,False,4x4,19,COMPLETE
61,61,0.8211964369940974,2023-01-15 14:19:39.000519,2023-01-15 14:20:33.653093,0 days 00:00:54.652574,0.0040026969061033495,PCA,303.9532729214231,linear,410,,71.0,189,none,False,4x4,19,COMPLETE
62,62,0.8260713788937769,2023-01-15 14:19:51.157386,2023-01-15 14:21:38.556390,0 days 00:01:47.399004,0.004539244832014857,PCA,441.22930134681974,linear,1023,,70.0,271,none,False,4x4,19,COMPLETE
63,63,0.8134535474602597,2023-01-15 14:20:33.747844,2023-01-15 14:21:49.725089,0 days 00:01:15.977245,0.004737553428015506,PCA,392.487177784593,linear,421,,71.0,191,none,False,4x4,19,COMPLETE
64,64,0.7997712235931433,2023-01-15 14:21:38.702210,2023-01-15 14:23:11.300442,0 days 00:01:32.598232,0.002152224642108856,PCA,113.09330893625445,linear,984,,60.0,274,none,False,4x4,20,COMPLETE
65,65,0.8329773302254265,2023-01-15 14:21:49.823029,2023-01-15 14:23:46.962080,0 days 00:01:57.139051,0.029754517997570826,PCA,122.4832774748165,linear,988,,51.0,263,none,False,4x4,20,COMPLETE
66,66,0.8259269728628553,2023-01-15 14:23:11.495205,2023-01-15 14:25:22.042632,0 days 00:02:10.547427,0.030537161108084052,PCA,705.1226739771869,linear,973,,50.0,267,none,False,vertical 1x4,20,COMPLETE
67,67,0.8257083984379465,2023-01-15 14:23:47.055076,2023-01-15 14:25:17.953423,0 days 00:01:30.898347,0.03104060058611844,PCA,143.28891206290263,linear,966,,52.0,287,none,False,vertical 1x4,18,COMPLETE
68,68,0.125,2023-01-15 14:25:18.069678,2023-01-15 14:27:07.895004,0 days 00:01:49.825326,0.0340925795974936,PCA,784.8538585833276,RBF,971,,75.0,268,none,False,vertical 1x4,20,COMPLETE
69,69,0.12596153846153846,2023-01-15 14:25:22.125174,2023-01-15 14:26:27.763370,0 days 00:01:05.638196,942.1535506611391,PCA,941.6439612879243,RBF,952,,50.0,249,none,False,vertical 1x4,19,COMPLETE
70,70,0.8183328459478789,2023-01-15 14:26:27.855667,2023-01-15 14:27:47.984745,0 days 00:01:20.129078,0.05199766368168502,PCA,618.4426711647242,linear,915,,49.0,236,none,False,vertical 1x4,18,COMPLETE
71,71,0.8230114380915297,2023-01-15 14:27:07.988097,2023-01-15 14:28:29.517258,0 days 00:01:21.529161,0.09081973955279117,PCA,600.1044832382502,linear,911,,75.0,240,none,False,4x4,18,COMPLETE
72,72,0.8308763129509698,2023-01-15 14:27:48.079836,2023-01-15 14:29:36.673400,0 days 00:01:48.593564,0.007500947309596058,PCA,67.57311448927237,linear,985,,68.0,264,none,False,4x4,20,COMPLETE
73,73,0.7907174374483763,2023-01-15 14:28:29.625443,2023-01-15 14:30:11.297364,0 days 00:01:41.671921,53.58349191593679,PCA,55.206643885038,linear,994,,68.0,266,none,False,4x4,19,COMPLETE
74,74,0.8228631849811769,2023-01-15 14:29:36.793560,2023-01-15 14:30:56.361471,0 days 00:01:19.567911,0.009273199220439255,PCA,76.30933574413685,linear,945,,57.0,224,none,False,vertical 1x4,19,COMPLETE
75,75,0.8284003561783833,2023-01-15 14:30:11.401508,2023-01-15 14:31:54.374945,0 days 00:01:42.973437,0.009173813635738113,PCA,77.20363460299345,linear,1022,,81.0,223,none,False,horizontal 2x1,20,COMPLETE
76,76,0.830065591941682,2023-01-15 14:30:56.451044,2023-01-15 14:32:35.727517,0 days 00:01:39.276473,0.021536085057106556,PCA,132.89408456476022,linear,971,,81.0,251,none,False,horizontal 2x1,20,COMPLETE
77,77,0.7979294721565248,2023-01-15 14:31:54.464082,2023-01-15 14:32:52.377700,0 days 00:00:57.913618,0.00270000770732436,PCA,21.53534754457589,linear,241,,81.0,211,none,False,horizontal 2x1,17,COMPLETE
78,78,0.8291922756061328,2023-01-15 14:32:35.811419,2023-01-15 14:34:28.321144,0 days 00:01:52.509725,0.019308441638136522,PCA,79.44898871074986,linear,843,,82.0,251,none,False,horizontal 2x1,20,COMPLETE
79,79,0.8263419673670009,2023-01-15 14:32:52.461125,2023-01-15 14:34:25.132290,0 days 00:01:32.671165,0.0220480991668982,PCA,130.8631177014522,linear,846,,83.0,197,none,False,horizontal 2x1,20,COMPLETE
80,80,0.7278514279493575,2023-01-15 14:34:25.246805,2023-01-15 14:34:55.722504,0 days 00:00:30.475699,0.007217309378964472,PCA,69.77943138221897,linear,939,,78.0,205,none,False,horizontal 2x1,4,COMPLETE
81,81,0.0,2023-01-15 14:34:28.399729,2023-01-15 14:35:05.717846,0 days 00:00:37.318117,0.26306532887102585,LDA,31.876389498164507,histogram_intersection,795,2.0,,253,none,False,horizontal 2x1,4,COMPLETE
82,82,0.824583727440988,2023-01-15 14:34:55.907562,2023-01-15 14:36:43.515177,0 days 00:01:47.607615,0.017255880368403406,PCA,83.85063150480423,linear,790,,74.0,223,none,False,horizontal 2x1,20,COMPLETE
83,83,0.8223614787185074,2023-01-15 14:35:05.811835,2023-01-15 14:36:48.736869,0 days 00:01:42.925034,0.07440342506029007,PCA,87.80486653463832,linear,980,,84.0,235,none,False,horizontal 2x1,20,COMPLETE
84,84,0.8231800152511507,2023-01-15 14:36:43.627462,2023-01-15 14:37:46.520889,0 days 00:01:02.893427,0.06819930299770488,PCA,45.6379081206435,linear,898,,81.0,252,none,False,2x2,18,COMPLETE
85,85,0.7932505187889913,2023-01-15 14:36:48.822094,2023-01-15 14:38:19.729157,0 days 00:01:30.907063,0.008053575212667335,PCA,51.87091129224935,linear,898,,29.0,260,none,False,horizontal 2x1,19,COMPLETE
86,86,0.8183151262566704,2023-01-15 14:37:46.607359,2023-01-15 14:39:05.789872,0 days 00:01:19.182513,0.008610840837043823,PCA,222.71038755614256,linear,933,,68.0,261,none,False,vertical 1x2,19,COMPLETE
87,87,0.810732871951733,2023-01-15 14:38:19.815302,2023-01-15 14:39:28.298863,0 days 00:01:08.483561,0.12545972717673112,PCA,267.17358792308517,linear,559,,95.0,220,none,False,vertical 1x3,18,COMPLETE
88,88,0.8192663169654064,2023-01-15 14:39:05.885801,2023-01-15 14:40:40.779883,0 days 00:01:34.894082,0.018082165064071537,PCA,161.71669187818185,linear,738,,77.0,223,none,False,horizontal 2x1,17,COMPLETE
89,89,0.8226108815591722,2023-01-15 14:39:28.394761,2023-01-15 14:40:23.740244,0 days 00:00:55.345483,0.04003449202828945,PCA,171.02421812791806,linear,863,,79.0,240,power,False,horizontal 2x1,17,COMPLETE
90,90,0.8167093580523215,2023-01-15 14:40:23.860869,2023-01-15 14:42:14.893647,0 days 00:01:51.032778,0.02130256188648861,PCA,20.8929784746382,linear,645,,86.0,248,none,False,horizontal 4x1,20,COMPLETE
91,91,0.0,2023-01-15 14:40:40.868957,2023-01-15 14:41:57.262320,0 days 00:01:16.393363,0.0264209381519801,PCA,19.81071738666033,histogram_intersection,955,,85.0,213,none,False,horizontal 4x1,20,COMPLETE
92,92,0.8262750183464842,2023-01-15 14:41:57.416866,2023-01-15 14:43:40.787205,0 days 00:01:43.370339,0.022919376160441075,PCA,128.21575309161776,linear,667,,82.0,185,none,False,horizontal 2x1,20,COMPLETE
93,93,0.8232369327942939,2023-01-15 14:42:15.007468,2023-01-15 14:43:46.099395,0 days 00:01:31.091927,0.014834016386056232,PCA,130.09848140303623,linear,846,,82.0,200,none,False,horizontal 2x1,20,COMPLETE
94,94,0.8230117167452299,2023-01-15 14:43:40.906334,2023-01-15 14:44:41.491732,0 days 00:01:00.585398,0.013191826896593555,PCA,106.89559822512264,linear,836,,89.0,197,none,False,horizontal 2x1,19,COMPLETE
95,95,0.8240682685553573,2023-01-15 14:43:46.193547,2023-01-15 14:45:22.699150,0 days 00:01:36.505603,0.011147897569317954,PCA,0.01376466922552744,linear,1000,,73.0,198,none,False,horizontal 2x1,19,COMPLETE
96,96,0.8276490790771298,2023-01-15 14:44:41.582957,2023-01-15 14:46:08.547451,0 days 00:01:26.964494,0.006315829623187838,PCA,33.262515829978724,linear,999,,95.0,243,none,False,vertical 1x2,18,COMPLETE
97,97,0.5040251996260094,2023-01-15 14:45:22.784822,2023-01-15 14:46:53.598590,0 days 00:01:30.813768,0.005878358502790482,LDA,37.20256301814859,linear,1019,5.0,,208,none,False,vertical 1x2,18,COMPLETE
98,98,0.5217635983462297,2023-01-15 14:46:08.643158,2023-01-15 14:47:42.842121,0 days 00:01:34.198963,0.005422845841212822,LDA,41.088567515450364,linear,1023,6.0,,243,none,False,vertical 1x2,18,COMPLETE
99,99,0.8253504180360045,2023-01-15 14:46:53.684836,2023-01-15 14:48:30.357779,0 days 00:01:36.672943,0.003361612555569521,PCA,0.20088932728434256,linear,982,,95.0,244,power,False,vertical 1x2,19,COMPLETE
100,100,0.125,2023-01-15 14:47:42.938345,2023-01-15 14:49:11.625135,0 days 00:01:28.686790,0.0038436739117650325,PCA,8.44340657574252,RBF,977,,93.0,232,power,False,2x2,19,COMPLETE
101,101,0.125,2023-01-15 14:48:30.461285,2023-01-15 14:49:54.966776,0 days 00:01:24.505491,0.0016197952858805033,PCA,1.9903295482003596,RBF,957,,84.0,276,l2,False,vertical 1x4,19,COMPLETE
102,102,0.8297005985982944,2023-01-15 14:49:11.722411,2023-01-15 14:50:53.710205,0 days 00:01:41.987794,0.04105405343856605,PCA,27.864984718999885,linear,925,,63.0,226,none,False,horizontal 2x1,20,COMPLETE
103,103,0.8290232692226892,2023-01-15 14:49:55.064340,2023-01-15 14:51:25.681122,0 days 00:01:30.616782,0.038206974830210724,PCA,76.09655542639454,linear,925,,63.0,219,none,False,horizontal 2x1,20,COMPLETE
104,104,0.8219426701719815,2023-01-15 14:50:53.873249,2023-01-15 14:52:28.716486,0 days 00:01:34.843237,0.04203677668375068,PCA,14.007684719506734,linear,934,,63.0,219,none,False,horizontal 2x1,20,COMPLETE
105,105,0.8304661261221616,2023-01-15 14:51:25.772127,2023-01-15 14:53:03.737796,0 days 00:01:37.965669,0.04914052080592519,PCA,61.43395802950195,linear,936,,63.0,226,none,False,horizontal 2x1,20,COMPLETE
106,106,0.826907847076996,2023-01-15 14:52:28.965127,2023-01-15 14:54:36.034504,0 days 00:02:07.069377,0.13289943737248047,PCA,69.095282008611,linear,902,,55.0,229,none,False,vertical 1x3,20,COMPLETE
107,107,0.8296950409671254,2023-01-15 14:53:03.831447,2023-01-15 14:54:10.102439,0 days 00:01:06.270992,0.12555114715803783,PCA,0.3487416036543921,linear,880,,54.0,227,l2,True,4x4,19,COMPLETE
