,number,value,datetime_start,datetime_complete,duration,params_dimensionality_reduction,params_metric,params_n_clusters,params_n_components,params_n_features,params_n_neighbors,params_patch_size,params_step_size,state
0,0,,2023-01-08 20:31:54.838821,,,,euclidean,64,24,124,8,2,64,RUNNING
1,1,,2023-01-08 20:31:54.865287,,,,manhattan,64,49,276,1,3,54,RUNNING
2,2,,2023-01-08 20:31:54.865719,,,,minkowski,512,35,109,14,3,38,RUNNING
3,3,,2023-01-08 20:31:54.911692,,,,euclidean,512,54,250,16,1,72,RUNNING
4,4,,2023-01-08 20:31:54.912334,,,,minkowski,64,96,193,11,3,9,RUNNING
5,5,,2023-01-08 20:31:54.950956,,,,minkowski,64,91,190,10,2,36,RUNNING
6,6,,2023-01-08 20:31:54.950471,,,,chebyshev,1024,29,167,17,2,41,RUNNING
7,7,,2023-01-08 20:31:54.988337,,,,minkowski,1024,19,158,7,2,12,RUNNING
8,8,0.7484707030828313,2023-01-08 20:33:13.911329,2023-01-08 20:34:09.109610,0 days 00:00:55.198281,PCA,chebyshev,256,36,172,12,1,11,COMPLETE
9,9,0.7296724462301774,2023-01-08 20:33:13.934889,2023-01-08 20:34:04.707025,0 days 00:00:50.772136,PCA,manhattan,256,35,295,9,1,5,COMPLETE
10,10,0.0,2023-01-08 20:33:13.959290,2023-01-08 20:35:09.641475,0 days 00:01:55.682185,None,manhattan,1024,4,190,16,3,38,COMPLETE
11,11,0.660037970495666,2023-01-08 20:33:13.986300,2023-01-08 20:34:27.104665,0 days 00:01:13.118365,PCA,chebyshev,64,54,279,12,2,8,COMPLETE
12,12,0.0,2023-01-08 20:33:14.011914,2023-01-08 20:35:04.936029,0 days 00:01:50.924115,None,minkowski,256,3,226,5,3,30,COMPLETE
13,13,0.0,2023-01-08 20:33:14.036597,2023-01-08 20:34:24.328150,0 days 00:01:10.291553,LDA,chebyshev,512,55,118,20,1,67,COMPLETE
14,14,0.0,2023-01-08 20:33:14.062487,2023-01-08 20:35:12.089097,0 days 00:01:58.026610,None,chebyshev,256,97,107,14,3,51,COMPLETE
15,15,0.0,2023-01-08 20:33:14.088337,2023-01-08 20:34:51.070597,0 days 00:01:36.982260,LDA,euclidean,256,27,210,2,2,29,COMPLETE
16,16,0.0,2023-01-08 20:34:04.994253,2023-01-08 20:35:17.550848,0 days 00:01:12.556595,LDA,euclidean,64,40,289,1,2,62,COMPLETE
17,17,0.0,2023-01-08 20:34:09.482441,2023-01-08 20:35:20.901533,0 days 00:01:11.419092,LDA,euclidean,256,40,108,8,2,12,COMPLETE
18,18,0.73304998015007,2023-01-08 20:37:17.012865,2023-01-08 20:38:17.286491,0 days 00:01:00.273626,PCA,minkowski,128,78,158,18,1,17,COMPLETE
19,19,0.7285000871378899,2023-01-08 20:37:17.037308,2023-01-08 20:38:20.711531,0 days 00:01:03.674223,PCA,minkowski,128,75,163,18,1,26,COMPLETE
20,20,0.7316250227361694,2023-01-08 20:37:17.062123,2023-01-08 20:38:23.491901,0 days 00:01:06.429778,PCA,minkowski,128,78,161,18,1,19,COMPLETE
21,21,0.7306033783801923,2023-01-08 20:37:17.087494,2023-01-08 20:38:29.584888,0 days 00:01:12.497394,PCA,minkowski,128,80,164,18,1,19,COMPLETE
22,22,0.7278882379692122,2023-01-08 20:37:17.111153,2023-01-08 20:38:14.083630,0 days 00:00:56.972477,PCA,minkowski,128,79,160,18,1,20,COMPLETE
23,23,0.7265282504950006,2023-01-08 20:37:17.136411,2023-01-08 20:38:26.520542,0 days 00:01:09.384131,PCA,minkowski,128,78,156,18,1,20,COMPLETE
24,24,0.7288918047526703,2023-01-08 20:37:17.159001,2023-01-08 20:38:10.992335,0 days 00:00:53.833334,PCA,minkowski,128,81,151,20,1,21,COMPLETE
25,25,0.7308506027117494,2023-01-08 20:37:17.184352,2023-01-08 20:38:07.942933,0 days 00:00:50.758581,PCA,minkowski,128,75,164,18,1,20,COMPLETE
26,26,0.7305106928090584,2023-01-08 20:38:08.267850,2023-01-08 20:39:12.063575,0 days 00:01:03.795725,PCA,minkowski,128,82,159,20,1,18,COMPLETE
27,27,0.73367086830947,2023-01-08 20:38:11.268789,2023-01-08 20:39:22.670733,0 days 00:01:11.401944,PCA,minkowski,128,75,163,16,1,20,COMPLETE
28,28,0.7344664423302572,2023-01-08 20:38:14.417446,2023-01-08 20:39:18.898497,0 days 00:01:04.481051,PCA,minkowski,128,68,168,12,1,18,COMPLETE
29,29,0.762574466915354,2023-01-08 20:38:17.612204,2023-01-08 20:40:05.387086,0 days 00:01:47.774882,PCA,chebyshev,1024,66,244,12,1,45,COMPLETE
30,30,0.6341836117077377,2023-01-08 20:38:20.978001,2023-01-08 20:38:43.265084,0 days 00:00:22.287083,PCA,chebyshev,512,19,244,12,1,2,COMPLETE
31,31,0.7715052560436793,2023-01-08 20:38:23.805167,2023-01-08 20:40:56.832121,0 days 00:02:33.026954,PCA,chebyshev,512,19,247,13,2,43,COMPLETE
32,32,0.0,2023-01-08 20:38:26.781126,2023-01-08 20:38:47.120009,0 days 00:00:20.338883,None,chebyshev,512,16,234,12,2,2,COMPLETE
33,33,0.6325673676111714,2023-01-08 20:38:29.700432,2023-01-08 20:38:54.194533,0 days 00:00:24.494101,PCA,chebyshev,512,63,248,12,2,2,COMPLETE
34,34,0.7830821452596781,2023-01-08 20:38:43.369006,2023-01-08 20:43:17.529706,0 days 00:04:34.160700,PCA,chebyshev,1024,61,134,14,2,41,COMPLETE
35,35,0.7855483405620262,2023-01-08 20:38:47.208262,2023-01-08 20:44:43.093277,0 days 00:05:55.885015,PCA,manhattan,1024,62,131,15,2,39,COMPLETE
36,36,0.7762683091866049,2023-01-08 20:38:54.301432,2023-01-08 20:40:57.787576,0 days 00:02:03.486144,PCA,minkowski,1024,96,133,15,1,12,COMPLETE
37,37,0.7612352615317383,2023-01-08 20:39:12.162236,2023-01-08 20:41:54.947921,0 days 00:02:42.785685,PCA,manhattan,1024,97,132,16,1,36,COMPLETE
38,38,0.7653452495364039,2023-01-08 20:39:19.012965,2023-01-08 20:42:33.992270,0 days 00:03:14.979305,PCA,manhattan,1024,65,132,15,1,40,COMPLETE
39,39,0.7638262941647943,2023-01-08 20:39:22.957277,2023-01-08 20:43:56.199016,0 days 00:04:33.241739,PCA,manhattan,1024,61,188,15,1,37,COMPLETE
40,40,0.0,2023-01-08 20:40:05.502351,2023-01-08 20:45:20.204849,0 days 00:05:14.702498,LDA,chebyshev,1024,64,187,8,2,48,COMPLETE
41,41,0.0,2023-01-08 20:40:57.030542,2023-01-08 20:42:30.642084,0 days 00:01:33.611542,None,chebyshev,1024,15,273,8,3,47,COMPLETE
42,42,0.0,2023-01-08 20:40:58.032994,2023-01-08 20:45:50.865424,0 days 00:04:52.832430,LDA,chebyshev,1024,99,265,15,3,48,COMPLETE
43,43,0.7786854372163691,2023-01-08 20:41:55.149689,2023-01-08 20:47:04.442973,0 days 00:05:09.293284,PCA,chebyshev,1024,92,262,14,3,44,COMPLETE
44,44,0.7822659213074467,2023-01-08 20:42:30.854573,2023-01-08 20:46:27.209802,0 days 00:03:56.355229,PCA,chebyshev,1024,91,258,14,2,50,COMPLETE
45,45,0.7801506167232909,2023-01-08 20:42:34.211605,2023-01-08 20:47:43.194080,0 days 00:05:08.982475,PCA,manhattan,1024,88,139,14,2,52,COMPLETE
46,46,0.784601178714234,2023-01-08 20:43:17.730570,2023-01-08 20:48:28.417685,0 days 00:05:10.687115,PCA,manhattan,1024,90,131,14,2,52,COMPLETE
47,47,0.7782621514175656,2023-01-08 20:43:56.441017,2023-01-08 20:49:01.999551,0 days 00:05:05.558534,PCA,manhattan,1024,46,139,14,2,57,COMPLETE
48,48,0.7811348905424647,2023-01-08 20:44:43.393596,2023-01-08 20:49:38.166449,0 days 00:04:54.772853,PCA,manhattan,1024,89,131,10,2,55,COMPLETE
49,49,0.7796280426236879,2023-01-08 20:45:20.392305,2023-01-08 20:50:17.827974,0 days 00:04:57.435669,PCA,manhattan,1024,46,140,10,2,42,COMPLETE
50,50,0.7847291789311586,2023-01-08 20:45:51.095317,2023-01-08 20:50:56.569327,0 days 00:05:05.474010,PCA,manhattan,1024,49,130,10,2,42,COMPLETE
51,51,0.0,2023-01-08 20:46:27.450563,2023-01-08 20:47:24.253873,0 days 00:00:56.803310,None,manhattan,1024,89,140,10,2,54,COMPLETE
52,52,0.7835889577841956,2023-01-08 20:47:04.648141,2023-01-08 20:51:25.294369,0 days 00:04:20.646228,PCA,manhattan,1024,89,213,14,2,55,COMPLETE
53,53,0.7869303780975988,2023-01-08 20:47:24.446392,2023-01-08 20:52:05.639667,0 days 00:04:41.193275,PCA,manhattan,1024,47,213,10,3,57,COMPLETE
54,54,0.7286167510891136,2023-01-08 20:47:43.604896,2023-01-08 20:51:14.830877,0 days 00:03:31.225981,PCA,manhattan,64,48,118,14,2,59,COMPLETE
55,55,0.731464377070079,2023-01-08 20:48:28.608912,2023-01-08 20:51:58.302564,0 days 00:03:29.693652,PCA,manhattan,64,52,100,10,2,64,COMPLETE
56,56,0.0,2023-01-08 20:49:02.197436,2023-01-08 20:52:02.690217,0 days 00:03:00.492781,PCA,manhattan,64,88,121,13,2,60,COMPLETE
57,57,0.7297702722235242,2023-01-08 20:49:38.364120,2023-01-08 20:52:06.987310,0 days 00:02:28.623190,PCA,manhattan,64,57,118,11,2,60,COMPLETE
58,58,0.0,2023-01-08 20:50:18.032090,2023-01-08 20:51:10.962734,0 days 00:00:52.930644,None,manhattan,64,56,117,11,2,74,COMPLETE
59,59,0.0,2023-01-08 20:50:56.918142,2023-01-08 20:52:37.980141,0 days 00:01:41.061999,LDA,manhattan,64,53,118,11,2,33,COMPLETE
60,60,0.7177995354653457,2023-01-08 20:51:11.150141,2023-01-08 20:52:46.994041,0 days 00:01:35.843900,PCA,euclidean,64,53,205,5,2,60,COMPLETE
61,61,0.7587830370556393,2023-01-08 20:51:15.046500,2023-01-08 20:52:59.506531,0 days 00:01:44.460031,PCA,euclidean,256,32,102,7,2,33,COMPLETE
62,62,0.7657617252248309,2023-01-08 20:51:25.511423,2023-01-08 20:53:11.562580,0 days 00:01:46.051157,PCA,euclidean,256,30,209,7,2,30,COMPLETE
63,63,0.7639444652389002,2023-01-08 20:51:58.481059,2023-01-08 20:54:19.706351,0 days 00:02:21.225292,PCA,euclidean,256,31,212,6,2,33,COMPLETE
64,64,0.7786714411029538,2023-01-08 20:52:02.869707,2023-01-08 20:54:27.319520,0 days 00:02:24.449813,PCA,euclidean,1024,35,208,6,2,32,COMPLETE
65,65,0.0,2023-01-08 20:52:05.790135,2023-01-08 20:54:34.090420,0 days 00:02:28.300285,LDA,euclidean,256,40,213,6,3,33,COMPLETE
66,66,0.0,2023-01-08 20:52:07.128011,2023-01-08 20:54:41.575702,0 days 00:02:34.447691,LDA,euclidean,256,36,208,7,3,35,COMPLETE
67,67,0.7610477631904337,2023-01-08 20:52:38.117427,2023-01-08 20:55:55.862198,0 days 00:03:17.744771,PCA,euclidean,256,35,205,6,3,68,COMPLETE
68,68,0.7620632258357738,2023-01-08 20:52:47.126082,2023-01-08 20:56:04.220871,0 days 00:03:17.094789,PCA,manhattan,256,34,217,9,3,68,COMPLETE
69,69,0.7905395588048424,2023-01-08 20:52:59.664497,2023-01-08 20:56:07.625918,0 days 00:03:07.961421,PCA,manhattan,1024,40,218,17,3,40,COMPLETE
70,70,0.7895071509399707,2023-01-08 20:53:11.696923,2023-01-08 20:57:12.947269,0 days 00:04:01.250346,PCA,manhattan,1024,42,222,16,3,69,COMPLETE
71,71,0.7850593163510784,2023-01-08 20:54:19.853826,2023-01-08 20:58:30.185431,0 days 00:04:10.331605,PCA,manhattan,1024,71,177,17,3,68,COMPLETE
72,72,0.7918419096635629,2023-01-08 20:54:27.720265,2023-01-08 20:59:57.965329,0 days 00:05:30.245064,PCA,manhattan,1024,70,221,17,3,66,COMPLETE
73,73,0.7920257012089105,2023-01-08 20:54:34.354742,2023-01-08 20:59:09.319688,0 days 00:04:34.964946,PCA,manhattan,1024,70,226,17,3,69,COMPLETE
74,74,0.7866717328702011,2023-01-08 20:54:41.703971,2023-01-08 20:57:50.067082,0 days 00:03:08.363111,PCA,manhattan,1024,70,176,17,2,66,COMPLETE
75,75,0.7848185082691315,2023-01-08 20:55:56.068415,2023-01-08 21:00:40.232552,0 days 00:04:44.164137,PCA,manhattan,1024,71,179,17,2,27,COMPLETE
76,76,0.7883484009464193,2023-01-08 20:56:04.566772,2023-01-08 21:01:34.964363,0 days 00:05:30.397591,PCA,manhattan,1024,70,149,17,2,51,COMPLETE
77,77,0.7909950712596101,2023-01-08 20:56:07.850360,2023-01-08 21:02:08.865609,0 days 00:06:01.015249,PCA,manhattan,1024,72,176,17,3,41,COMPLETE
78,78,0.0,2023-01-08 20:57:13.157275,2023-01-08 20:59:20.831424,0 days 00:02:07.674149,None,manhattan,1024,70,197,17,3,27,COMPLETE
79,79,0.7883434094099041,2023-01-08 20:57:50.353870,2023-01-08 21:02:50.691628,0 days 00:05:00.337758,PCA,manhattan,1024,42,181,17,3,73,COMPLETE
80,80,0.7926645643639351,2023-01-08 20:58:30.376152,2023-01-08 21:03:31.089949,0 days 00:05:00.713797,PCA,manhattan,1024,72,194,19,3,72,COMPLETE
81,81,0.7876985145225992,2023-01-08 20:59:09.593745,2023-01-08 21:04:16.784656,0 days 00:05:07.190911,PCA,manhattan,1024,70,177,17,3,72,COMPLETE
82,82,0.7868546517283054,2023-01-08 20:59:21.060582,2023-01-08 21:04:59.633379,0 days 00:05:38.572797,PCA,manhattan,1024,42,178,19,3,73,COMPLETE
83,83,0.7944045718215607,2023-01-08 20:59:58.156454,2023-01-08 21:05:36.328473,0 days 00:05:38.172019,PCA,manhattan,1024,42,231,19,3,72,COMPLETE
84,84,0.7950220824256273,2023-01-08 21:00:40.420481,2023-01-08 21:06:19.045069,0 days 00:05:38.624588,PCA,manhattan,1024,44,225,19,3,75,COMPLETE
85,85,0.7878319561180467,2023-01-08 21:01:35.223748,2023-01-08 21:07:03.360437,0 days 00:05:28.136689,PCA,manhattan,1024,83,225,19,3,72,COMPLETE
86,86,0.7930109490583284,2023-01-08 21:02:09.076758,2023-01-08 21:07:43.679905,0 days 00:05:34.603147,PCA,manhattan,1024,41,225,19,3,72,COMPLETE
87,87,0.7937003775987639,2023-01-08 21:02:50.892343,2023-01-08 21:08:24.336772,0 days 00:05:33.444429,PCA,manhattan,1024,42,228,19,3,73,COMPLETE
88,88,0.7938742905935215,2023-01-08 21:03:31.288026,2023-01-08 21:09:13.629485,0 days 00:05:42.341459,PCA,manhattan,1024,39,223,19,3,73,COMPLETE
89,89,0.7924253381737107,2023-01-08 21:04:17.010937,2023-01-08 21:09:58.421589,0 days 00:05:41.410652,PCA,manhattan,1024,43,225,19,3,71,COMPLETE
90,90,0.7924798923880287,2023-01-08 21:04:59.819087,2023-01-08 21:10:37.540241,0 days 00:05:37.721154,PCA,manhattan,1024,75,227,19,3,72,COMPLETE
91,91,0.7824158404130391,2023-01-08 21:05:36.584042,2023-01-08 21:10:40.888946,0 days 00:05:04.304904,PCA,manhattan,512,84,225,19,3,71,COMPLETE
92,92,0.0,2023-01-08 21:06:19.309403,2023-01-08 21:07:47.326164,0 days 00:01:28.016761,None,manhattan,512,58,225,19,3,71,COMPLETE
93,93,0.7775854964532517,2023-01-08 21:07:03.563262,2023-01-08 21:10:55.599499,0 days 00:03:52.036237,PCA,manhattan,512,25,233,19,3,70,COMPLETE
94,94,0.7767576055248616,2023-01-08 21:07:43.875807,2023-01-08 21:11:08.674864,0 days 00:03:24.799057,PCA,manhattan,512,27,233,19,3,75,COMPLETE
95,95,0.7901710907448943,2023-01-08 21:07:47.489083,2023-01-08 21:12:10.407198,0 days 00:04:22.918115,PCA,manhattan,1024,84,233,20,3,65,COMPLETE
96,96,0.7847991997048999,2023-01-08 21:08:24.561353,2023-01-08 21:12:52.747042,0 days 00:04:28.185689,PCA,manhattan,1024,74,234,20,3,63,COMPLETE
97,97,0.7952500841872735,2023-01-08 21:09:13.904633,2023-01-08 21:13:36.086279,0 days 00:04:22.181646,PCA,manhattan,1024,27,233,20,3,75,COMPLETE
98,98,0.7948605030492754,2023-01-08 21:09:58.581829,2023-01-08 21:14:23.234092,0 days 00:04:24.652263,PCA,manhattan,1024,44,233,19,3,75,COMPLETE
99,99,0.7890260222967456,2023-01-08 21:10:37.688064,2023-01-08 21:15:45.747575,0 days 00:05:08.059511,PCA,manhattan,1024,38,233,20,3,70,COMPLETE
100,100,0.7964032520392843,2023-01-08 21:10:41.205813,2023-01-08 21:15:04.907145,0 days 00:04:23.701332,PCA,manhattan,1024,28,234,20,3,75,COMPLETE
101,101,0.0,2023-01-08 21:10:55.777806,2023-01-08 21:16:26.936641,0 days 00:05:31.158835,LDA,manhattan,1024,44,234,20,3,75,COMPLETE
102,102,0.0,2023-01-08 21:11:08.988840,2023-01-08 21:17:14.135500,0 days 00:06:05.146660,LDA,manhattan,1024,38,239,20,3,63,COMPLETE
103,103,0.7965666021845843,2023-01-08 21:12:10.652672,2023-01-08 21:17:54.094381,0 days 00:05:43.441709,PCA,manhattan,1024,44,242,20,3,75,COMPLETE
104,104,0.7874358407878933,2023-01-08 21:12:52.973189,2023-01-08 21:18:34.368006,0 days 00:05:41.394817,PCA,manhattan,1024,38,241,18,3,74,COMPLETE
105,105,0.7956013096597458,2023-01-08 21:13:36.380821,2023-01-08 21:19:11.643895,0 days 00:05:35.263074,PCA,manhattan,1024,44,238,20,3,75,COMPLETE
106,106,0.795479425318034,2023-01-08 21:14:23.419266,2023-01-08 21:19:56.173444,0 days 00:05:32.754178,PCA,manhattan,1024,44,240,20,3,75,COMPLETE
107,107,0.7868743154761412,2023-01-08 21:15:05.108125,2023-01-08 21:20:30.727857,0 days 00:05:25.619732,PCA,manhattan,1024,38,240,20,3,74,COMPLETE
108,108,0.7911217728264748,2023-01-08 21:15:45.940864,2023-01-08 21:21:20.621076,0 days 00:05:34.680212,PCA,manhattan,1024,45,240,18,3,74,COMPLETE
109,109,0.7954563995781347,2023-01-08 21:16:27.134989,2023-01-08 21:22:05.847268,0 days 00:05:38.712279,PCA,manhattan,1024,24,242,18,3,75,COMPLETE
110,110,0.7949129027409721,2023-01-08 21:17:14.377707,2023-01-08 21:22:45.570524,0 days 00:05:31.192817,PCA,manhattan,1024,28,241,18,3,75,COMPLETE
111,111,0.746187603103517,2023-01-08 21:17:54.279160,2023-01-08 21:22:26.650742,0 days 00:04:32.371582,PCA,minkowski,128,23,246,18,3,75,COMPLETE
112,112,0.7760134568299565,2023-01-08 21:18:34.588435,2023-01-08 21:23:14.770756,0 days 00:04:40.182321,PCA,manhattan,1024,9,247,18,3,75,COMPLETE
113,113,0.0,2023-01-08 21:19:12.201177,2023-01-08 21:20:52.815204,0 days 00:01:40.614027,None,minkowski,128,50,252,18,3,75,COMPLETE
114,114,0.7444820040528091,2023-01-08 21:19:56.663770,2023-01-08 21:23:09.685459,0 days 00:03:13.021689,PCA,minkowski,128,23,253,18,3,75,COMPLETE
115,115,0.7505852685523442,2023-01-08 21:20:31.049407,2023-01-08 21:23:13.928143,0 days 00:02:42.878736,PCA,minkowski,128,51,249,18,3,75,COMPLETE
116,116,0.7993374248360292,2023-01-08 21:20:53.027311,2023-01-08 21:23:59.010415,0 days 00:03:05.983104,PCA,manhattan,1024,46,251,18,3,75,COMPLETE
117,117,0.7971217512300426,2023-01-08 21:21:20.838414,2023-01-08 21:24:15.899704,0 days 00:02:55.061290,PCA,manhattan,1024,23,250,20,3,75,COMPLETE
