,number,value,datetime_start,datetime_complete,duration,params_dimensionality_reduction,params_n_components_LDA,params_n_components_PCA,params_normalization,state
180,180,0.8276197304688833,2023-01-15 17:51:35.837787,2023-01-15 17:54:07.088158,0 days 00:02:31.250371,PCA,,89.0,,COMPLETE
181,181,0.8460020598439628,2023-01-15 17:51:54.164198,2023-01-15 17:54:26.274855,0 days 00:02:32.110657,PCA,,74.0,,COMPLETE
182,182,0.8434940447839375,2023-01-15 17:52:12.895874,2023-01-15 17:54:45.070959,0 days 00:02:32.175085,PCA,,88.0,,COMPLETE
183,183,0.8312280139823441,2023-01-15 17:52:32.250191,2023-01-15 17:55:04.147691,0 days 00:02:31.897500,PCA,,90.0,,COMPLETE
184,184,0.8336820883192401,2023-01-15 17:52:51.218463,2023-01-15 17:55:23.456289,0 days 00:02:32.237826,PCA,,88.0,,COMPLETE
185,185,0.8477179736361512,2023-01-15 17:53:10.073535,2023-01-15 17:55:42.104949,0 days 00:02:32.031414,PCA,,73.0,,COMPLETE
186,186,0.8426512435667035,2023-01-15 17:53:29.902184,2023-01-15 17:56:01.284692,0 days 00:02:31.382508,PCA,,83.0,,COMPLETE
187,187,0.836428036848034,2023-01-15 17:53:48.369903,2023-01-15 17:56:19.880665,0 days 00:02:31.510762,PCA,,88.0,,COMPLETE
188,188,0.8460962452118009,2023-01-15 17:54:07.261132,2023-01-15 17:56:38.967636,0 days 00:02:31.706504,PCA,,63.0,,COMPLETE
189,189,0.8415857484950191,2023-01-15 17:54:26.538174,2023-01-15 17:56:57.600284,0 days 00:02:31.062110,PCA,,78.0,,COMPLETE
190,190,0.8378458713073839,2023-01-15 17:54:45.258985,2023-01-15 17:57:16.798560,0 days 00:02:31.539575,PCA,,78.0,,COMPLETE
191,191,0.8368087625827754,2023-01-15 17:55:04.375140,2023-01-15 17:57:35.712866,0 days 00:02:31.337726,PCA,,77.0,,COMPLETE
192,192,0.8466935826602491,2023-01-15 17:55:23.661566,2023-01-15 17:57:54.791368,0 days 00:02:31.129802,PCA,,77.0,,COMPLETE
193,193,0.8482716343441359,2023-01-15 17:55:42.304020,2023-01-15 17:58:13.998859,0 days 00:02:31.694839,PCA,,78.0,,COMPLETE
194,194,0.8399622442090336,2023-01-15 17:56:01.476963,2023-01-15 17:58:33.020166,0 days 00:02:31.543203,PCA,,67.0,,COMPLETE
195,195,0.8365497513420805,2023-01-15 17:56:20.197112,2023-01-15 17:58:51.639475,0 days 00:02:31.442363,PCA,,77.0,,COMPLETE
196,196,0.8414291810095094,2023-01-15 17:56:39.189019,2023-01-15 17:59:10.765546,0 days 00:02:31.576527,PCA,,63.0,,COMPLETE
197,197,0.8448962178577799,2023-01-15 17:56:58.035932,2023-01-15 17:59:29.989063,0 days 00:02:31.953131,PCA,,64.0,,COMPLETE
198,198,0.8464133880265076,2023-01-15 17:57:16.997249,2023-01-15 17:59:48.484810,0 days 00:02:31.487561,PCA,,62.0,,COMPLETE
199,199,0.8381191234416793,2023-01-15 17:57:36.090551,2023-01-15 18:00:07.709334,0 days 00:02:31.618783,PCA,,53.0,,COMPLETE
200,200,0.845127827140551,2023-01-15 17:57:55.034132,2023-01-15 18:00:26.203910,0 days 00:02:31.169778,PCA,,67.0,,COMPLETE
201,201,0.8429632720001663,2023-01-15 17:58:14.333548,2023-01-15 18:00:45.483648,0 days 00:02:31.150100,PCA,,82.0,,COMPLETE
202,202,0.8368754049072393,2023-01-15 17:58:33.226554,2023-01-15 18:01:04.607196,0 days 00:02:31.380642,PCA,,82.0,,COMPLETE
203,203,0.8432734127726433,2023-01-15 17:58:52.099004,2023-01-15 18:01:23.345527,0 days 00:02:31.246523,PCA,,82.0,,COMPLETE
204,204,0.8435086723993456,2023-01-15 17:59:10.943404,2023-01-15 18:01:42.315202,0 days 00:02:31.371798,PCA,,81.0,,COMPLETE
205,205,0.8403702413339091,2023-01-15 17:59:30.257833,2023-01-15 18:02:01.123940,0 days 00:02:30.866107,PCA,,74.0,,COMPLETE
206,206,0.8386041946931435,2023-01-15 17:59:48.661110,2023-01-15 18:02:20.069022,0 days 00:02:31.407912,PCA,,67.0,,COMPLETE
207,207,0.8389322407741439,2023-01-15 18:00:07.914641,2023-01-15 18:02:39.035542,0 days 00:02:31.120901,PCA,,82.0,,COMPLETE
208,208,0.8419027294916784,2023-01-15 18:00:26.409111,2023-01-15 18:02:57.800900,0 days 00:02:31.391789,PCA,,81.0,,COMPLETE
209,209,0.8436641562312724,2023-01-15 18:00:45.704305,2023-01-15 18:03:16.996581,0 days 00:02:31.292276,PCA,,73.0,,COMPLETE
210,210,0.8426978263983316,2023-01-15 18:01:04.802696,2023-01-15 18:03:35.753278,0 days 00:02:30.950582,PCA,,73.0,,COMPLETE
211,211,0.845291406649476,2023-01-15 18:01:23.839268,2023-01-15 18:03:54.569130,0 days 00:02:30.729862,PCA,,57.0,,COMPLETE
212,212,0.8440347923001841,2023-01-15 18:01:42.756581,2023-01-15 18:04:08.756114,0 days 00:02:25.999533,PCA,,57.0,,COMPLETE
213,213,,2023-01-15 18:06:28.623677,,,,,,power,RUNNING
214,214,0.8449082141873312,2023-01-15 18:06:28.648509,2023-01-15 18:07:55.649089,0 days 00:01:27.000580,,,,power,COMPLETE
215,215,0.8493378727916131,2023-01-15 18:06:28.670727,2023-01-15 18:07:36.427669,0 days 00:01:07.756942,,,,l2,COMPLETE
216,216,0.8474333185790467,2023-01-15 18:06:28.695171,2023-01-15 18:06:58.861073,0 days 00:00:30.165902,,,,l2,COMPLETE
217,217,,2023-01-15 18:06:28.720346,,,,,,power,RUNNING
218,218,0.8467025129927412,2023-01-15 18:06:28.759777,2023-01-15 18:07:17.685180,0 days 00:00:48.925403,,,,none,COMPLETE
219,219,0.8397338097578224,2023-01-15 18:06:28.785255,2023-01-15 18:08:15.297630,0 days 00:01:46.512375,,,,power,COMPLETE
220,220,,2023-01-15 18:06:28.809929,,,,,,l2,RUNNING
221,221,,2023-01-15 18:06:59.057856,,,,,,l2,RUNNING
222,222,,2023-01-15 18:07:17.880345,,,,,,l2,RUNNING
223,223,,2023-01-15 18:07:36.900779,,,,,,l2,RUNNING
224,224,,2023-01-15 18:07:56.184431,,,,,,l2,RUNNING
