,number,value,datetime_start,datetime_complete,duration,params_dimensionality_reduction,params_n_components_LDA,params_n_components_PCA,params_normalization,state
0,0,0.6957487543729012,2023-01-15 16:52:06.001285,2023-01-15 16:54:12.684457,0 days 00:02:06.683172,LDA,7.0,,,COMPLETE
1,1,0.2705082089324968,2023-01-15 16:52:06.004393,2023-01-15 16:52:42.241897,0 days 00:00:36.237504,LDA,1.0,,,COMPLETE
2,2,0.6236566302153969,2023-01-15 16:52:06.047521,2023-01-15 16:53:24.089797,0 days 00:01:18.042276,LDA,4.0,,,COMPLETE
3,3,0.6236566302153969,2023-01-15 16:52:06.070891,2023-01-15 16:53:47.918202,0 days 00:01:41.847311,LDA,4.0,,,COMPLETE
4,4,,2023-01-15 16:52:06.095418,,,PCA,,49.0,,RUNNING
5,5,,2023-01-15 16:52:06.118058,,,LDA,3.0,,,RUNNING
6,6,0.5359991226257107,2023-01-15 16:52:06.141448,2023-01-15 16:54:36.913464,0 days 00:02:30.772016,LDA,3.0,,,COMPLETE
7,7,0.8432726865536727,2023-01-15 16:52:06.165346,2023-01-15 16:52:59.177114,0 days 00:00:53.011768,PCA,,75.0,,COMPLETE
8,8,,2023-01-15 16:52:43.055862,,,LDA,6.0,,,RUNNING
9,9,,2023-01-15 16:52:59.481930,,,LDA,1.0,,,RUNNING
10,10,,2023-01-15 16:53:24.522807,,,LDA,2.0,,,RUNNING
11,11,,2023-01-15 16:53:48.218552,,,LDA,1.0,,,RUNNING
12,12,,2023-01-15 16:54:12.951283,,,LDA,7.0,,,RUNNING
13,13,0.8307124882874213,2023-01-15 16:58:54.867815,2023-01-15 16:59:24.589596,0 days 00:00:29.721781,PCA,,92.0,,COMPLETE
14,14,0.7261019521819352,2023-01-15 16:58:54.891712,2023-01-15 17:00:14.431452,0 days 00:01:19.539740,LDA,7.0,,,COMPLETE
15,15,0.5663107505964712,2023-01-15 16:58:54.914380,2023-01-15 16:59:49.936533,0 days 00:00:55.022153,LDA,3.0,,,COMPLETE
16,16,0.6638122309415512,2023-01-15 16:58:54.938660,2023-01-15 17:01:53.737091,0 days 00:02:58.798431,LDA,4.0,,,COMPLETE
17,17,0.8477258805809909,2023-01-15 16:58:54.960920,2023-01-15 17:00:50.939051,0 days 00:01:55.978131,PCA,,62.0,,COMPLETE
18,18,0.8436230226085234,2023-01-15 16:58:54.985181,2023-01-15 17:00:32.036937,0 days 00:01:37.051756,PCA,,54.0,,COMPLETE
19,19,0.8412431262991854,2023-01-15 16:58:55.007387,2023-01-15 17:01:09.635493,0 days 00:02:14.628106,PCA,,55.0,,COMPLETE
20,20,0.6884568207093852,2023-01-15 16:58:55.031446,2023-01-15 17:01:28.534305,0 days 00:02:33.502859,PCA,,3.0,,COMPLETE
21,21,0.8086141212725437,2023-01-15 16:59:25.154538,2023-01-15 17:02:11.263125,0 days 00:02:46.108587,PCA,,14.0,,COMPLETE
22,22,0.8364549754266968,2023-01-15 16:59:50.127953,2023-01-15 17:02:31.129697,0 days 00:02:41.001744,PCA,,96.0,,COMPLETE
23,23,0.7261019521819352,2023-01-15 17:00:14.591957,2023-01-15 17:02:56.684604,0 days 00:02:42.092647,LDA,7.0,,,COMPLETE
24,24,0.81645973125932,2023-01-15 17:00:32.286044,2023-01-15 17:03:14.856569,0 days 00:02:42.570525,PCA,,19.0,,COMPLETE
25,25,0.8267753157193551,2023-01-15 17:00:51.180391,2023-01-15 17:03:33.426976,0 days 00:02:42.246585,PCA,,35.0,,COMPLETE
26,26,0.8212093237074743,2023-01-15 17:01:09.801492,2023-01-15 17:03:52.597157,0 days 00:02:42.795665,PCA,,22.0,,COMPLETE
27,27,0.831735877342911,2023-01-15 17:01:28.782849,2023-01-15 17:04:11.614947,0 days 00:02:42.832098,PCA,,39.0,,COMPLETE
28,28,0.8314413055354082,2023-01-15 17:01:54.350453,2023-01-15 17:04:30.831580,0 days 00:02:36.481127,PCA,,42.0,,COMPLETE
29,29,0.8392092537187423,2023-01-15 17:02:11.394797,2023-01-15 17:04:49.426118,0 days 00:02:38.031321,PCA,,47.0,,COMPLETE
30,30,0.83574493663486,2023-01-15 17:02:31.303184,2023-01-15 17:05:08.332041,0 days 00:02:37.028857,PCA,,46.0,,COMPLETE
31,31,0.8333884544962871,2023-01-15 17:02:57.157547,2023-01-15 17:05:27.655013,0 days 00:02:30.497466,PCA,,44.0,,COMPLETE
32,32,0.8388044815776953,2023-01-15 17:03:15.426327,2023-01-15 17:05:46.654972,0 days 00:02:31.228645,PCA,,47.0,,COMPLETE
33,33,0.8374615898487958,2023-01-15 17:03:33.916989,2023-01-15 17:06:05.555701,0 days 00:02:31.638712,PCA,,55.0,,COMPLETE
34,34,0.8378527184898752,2023-01-15 17:03:52.773875,2023-01-15 17:06:24.351020,0 days 00:02:31.577145,PCA,,58.0,,COMPLETE
35,35,0.8420112636761565,2023-01-15 17:04:11.833835,2023-01-15 17:06:43.461007,0 days 00:02:31.627172,PCA,,67.0,,COMPLETE
36,36,0.8393155644150031,2023-01-15 17:04:31.065072,2023-01-15 17:07:02.391124,0 days 00:02:31.326052,PCA,,67.0,,COMPLETE
37,37,0.8469975950105507,2023-01-15 17:04:49.818497,2023-01-15 17:07:21.510712,0 days 00:02:31.692215,PCA,,67.0,,COMPLETE
38,38,0.8394053981764615,2023-01-15 17:05:08.643981,2023-01-15 17:07:40.578283,0 days 00:02:31.934302,PCA,,71.0,,COMPLETE
39,39,0.8419012694845025,2023-01-15 17:05:27.939595,2023-01-15 17:07:59.585267,0 days 00:02:31.645672,PCA,,68.0,,COMPLETE
40,40,0.844861552654168,2023-01-15 17:05:46.969437,2023-01-15 17:08:18.051739,0 days 00:02:31.082302,PCA,,69.0,,COMPLETE
41,41,0.8408797398921777,2023-01-15 17:06:05.817070,2023-01-15 17:08:37.640074,0 days 00:02:31.823004,PCA,,72.0,,COMPLETE
42,42,0.8433832422739153,2023-01-15 17:06:24.541669,2023-01-15 17:08:56.444569,0 days 00:02:31.902900,PCA,,72.0,,COMPLETE
43,43,0.8421753605113553,2023-01-15 17:06:43.656233,2023-01-15 17:09:16.052353,0 days 00:02:32.396120,PCA,,75.0,,COMPLETE
44,44,0.8376233023641884,2023-01-15 17:07:02.585453,2023-01-15 17:09:35.949355,0 days 00:02:33.363902,PCA,,82.0,,COMPLETE
45,45,0.8470640542588435,2023-01-15 17:07:21.740567,2023-01-15 17:09:55.537560,0 days 00:02:33.796993,PCA,,80.0,,COMPLETE
46,46,0.8353668892354434,2023-01-15 17:07:41.007699,2023-01-15 17:10:14.611833,0 days 00:02:33.604134,PCA,,83.0,,COMPLETE
47,47,0.8387486878378686,2023-01-15 17:07:59.770054,2023-01-15 17:10:34.410767,0 days 00:02:34.640713,PCA,,83.0,,COMPLETE
48,48,0.8454560673332472,2023-01-15 17:08:18.620565,2023-01-15 17:10:53.621633,0 days 00:02:35.001068,PCA,,80.0,,COMPLETE
49,49,0.843670030096266,2023-01-15 17:08:37.809801,2023-01-15 17:11:13.703426,0 days 00:02:35.893625,PCA,,81.0,,COMPLETE
50,50,0.8426009699156941,2023-01-15 17:08:56.723461,2023-01-15 17:11:33.076336,0 days 00:02:36.352875,PCA,,83.0,,COMPLETE
51,51,0.8397569921552008,2023-01-15 17:09:16.230803,2023-01-15 17:11:52.336592,0 days 00:02:36.105789,PCA,,86.0,,COMPLETE
52,52,0.2907741260176605,2023-01-15 17:09:36.117972,2023-01-15 17:12:18.565553,0 days 00:02:42.447581,LDA,1.0,,,COMPLETE
53,53,0.2907741260176605,2023-01-15 17:09:55.749729,2023-01-15 17:12:42.730908,0 days 00:02:46.981179,LDA,1.0,,,COMPLETE
54,54,0.2907741260176605,2023-01-15 17:10:14.814441,2023-01-15 17:13:06.562901,0 days 00:02:51.748460,LDA,1.0,,,COMPLETE
55,55,0.2907741260176605,2023-01-15 17:10:34.579007,2023-01-15 17:13:32.517428,0 days 00:02:57.938421,LDA,1.0,,,COMPLETE
56,56,0.2907741260176605,2023-01-15 17:10:54.392681,2023-01-15 17:13:56.177593,0 days 00:03:01.784912,LDA,1.0,,,COMPLETE
57,57,0.2907741260176605,2023-01-15 17:11:14.095898,2023-01-15 17:14:22.030357,0 days 00:03:07.934459,LDA,1.0,,,COMPLETE
58,58,0.2907741260176605,2023-01-15 17:11:33.382189,2023-01-15 17:14:46.605337,0 days 00:03:13.223148,LDA,1.0,,,COMPLETE
59,59,0.2907741260176605,2023-01-15 17:11:52.507672,2023-01-15 17:15:10.691269,0 days 00:03:18.183597,LDA,1.0,,,COMPLETE
60,60,0.7100227755801762,2023-01-15 17:12:18.754860,2023-01-15 17:15:35.247347,0 days 00:03:16.492487,LDA,6.0,,,COMPLETE
61,61,0.7100227755801762,2023-01-15 17:12:43.290095,2023-01-15 17:16:00.391193,0 days 00:03:17.101098,LDA,6.0,,,COMPLETE
62,62,0.8435719250495991,2023-01-15 17:13:07.146253,2023-01-15 17:16:18.969850,0 days 00:03:11.823597,PCA,,63.0,,COMPLETE
63,63,0.8419378102575944,2023-01-15 17:13:32.832507,2023-01-15 17:16:38.052877,0 days 00:03:05.220370,PCA,,63.0,,COMPLETE
64,64,0.8389025563955977,2023-01-15 17:13:56.876561,2023-01-15 17:16:57.084966,0 days 00:03:00.208405,PCA,,61.0,,COMPLETE
65,65,0.845223337421125,2023-01-15 17:14:22.256850,2023-01-15 17:17:16.075532,0 days 00:02:53.818682,PCA,,60.0,,COMPLETE
66,66,0.8324006070409992,2023-01-15 17:14:46.817596,2023-01-15 17:17:35.326447,0 days 00:02:48.508851,PCA,,60.0,,COMPLETE
67,67,0.8455524097905786,2023-01-15 17:15:11.056095,2023-01-15 17:17:53.993939,0 days 00:02:42.937844,PCA,,62.0,,COMPLETE
68,68,0.8445623167377043,2023-01-15 17:15:35.492590,2023-01-15 17:18:13.114973,0 days 00:02:37.622383,PCA,,62.0,,COMPLETE
69,69,0.8396399385873907,2023-01-15 17:16:00.855557,2023-01-15 17:18:31.933226,0 days 00:02:31.077669,PCA,,61.0,,COMPLETE
70,70,0.839122554975229,2023-01-15 17:16:19.132978,2023-01-15 17:18:50.826135,0 days 00:02:31.693157,PCA,,92.0,,COMPLETE
71,71,0.8483690144040841,2023-01-15 17:16:38.266454,2023-01-15 17:19:10.462152,0 days 00:02:32.195698,PCA,,78.0,,COMPLETE
72,72,0.8325921950253996,2023-01-15 17:16:57.245222,2023-01-15 17:19:29.611424,0 days 00:02:32.366202,PCA,,90.0,,COMPLETE
73,73,0.8400731211211218,2023-01-15 17:17:16.285773,2023-01-15 17:19:48.772779,0 days 00:02:32.487006,PCA,,77.0,,COMPLETE
74,74,0.836818864924212,2023-01-15 17:17:35.529734,2023-01-15 17:20:08.050024,0 days 00:02:32.520290,PCA,,90.0,,COMPLETE
75,75,0.8489954184135959,2023-01-15 17:17:54.315791,2023-01-15 17:20:26.869433,0 days 00:02:32.553642,PCA,,75.0,,COMPLETE
76,76,0.8432288094050403,2023-01-15 17:18:13.864589,2023-01-15 17:20:45.712829,0 days 00:02:31.848240,PCA,,92.0,,COMPLETE
77,77,0.8444388998759116,2023-01-15 17:18:32.124245,2023-01-15 17:21:05.177198,0 days 00:02:33.052953,PCA,,78.0,,COMPLETE
78,78,0.8424998036701412,2023-01-15 17:18:51.268036,2023-01-15 17:21:24.167924,0 days 00:02:32.899888,PCA,,53.0,,COMPLETE
79,79,0.8443261832763579,2023-01-15 17:19:11.009301,2023-01-15 17:21:43.035022,0 days 00:02:32.025721,PCA,,78.0,,COMPLETE
80,80,0.8413499900854907,2023-01-15 17:19:30.094425,2023-01-15 17:22:02.394412,0 days 00:02:32.299987,PCA,,78.0,,COMPLETE
81,81,0.8363172024363189,2023-01-15 17:19:49.027851,2023-01-15 17:22:21.086751,0 days 00:02:32.058900,PCA,,99.0,,COMPLETE
82,82,0.8421058923141747,2023-01-15 17:20:08.241106,2023-01-15 17:22:40.589764,0 days 00:02:32.348658,PCA,,51.0,,COMPLETE
83,83,0.836917335251175,2023-01-15 17:20:27.126135,2023-01-15 17:22:59.514478,0 days 00:02:32.388343,PCA,,100.0,,COMPLETE
84,84,0.8446571673447412,2023-01-15 17:20:46.225626,2023-01-15 17:23:18.567431,0 days 00:02:32.341805,PCA,,78.0,,COMPLETE
85,85,0.8417064792759824,2023-01-15 17:21:05.573863,2023-01-15 17:23:37.567147,0 days 00:02:31.993284,PCA,,75.0,,COMPLETE
86,86,0.8410550363718714,2023-01-15 17:21:24.368440,2023-01-15 17:23:56.415537,0 days 00:02:32.047097,PCA,,74.0,,COMPLETE
87,87,0.8407533913668462,2023-01-15 17:21:43.228207,2023-01-15 17:24:15.419233,0 days 00:02:32.191026,PCA,,51.0,,COMPLETE
88,88,0.8357571451909218,2023-01-15 17:22:02.559608,2023-01-15 17:24:34.771848,0 days 00:02:32.212240,PCA,,100.0,,COMPLETE
89,89,0.8406890862804222,2023-01-15 17:22:21.470014,2023-01-15 17:24:53.478216,0 days 00:02:32.008202,PCA,,56.0,,COMPLETE
90,90,0.8392443638572514,2023-01-15 17:22:40.775790,2023-01-15 17:25:12.812629,0 days 00:02:32.036839,PCA,,73.0,,COMPLETE
91,91,0.8340147057388633,2023-01-15 17:22:59.755230,2023-01-15 17:25:32.245710,0 days 00:02:32.490480,PCA,,57.0,,COMPLETE
92,92,0.8416513006909667,2023-01-15 17:23:18.765154,2023-01-15 17:25:50.646983,0 days 00:02:31.881829,PCA,,55.0,,COMPLETE
93,93,0.8399984401935597,2023-01-15 17:23:37.765989,2023-01-15 17:26:09.420335,0 days 00:02:31.654346,PCA,,56.0,,COMPLETE
94,94,0.8399864866265976,2023-01-15 17:23:57.035988,2023-01-15 17:26:28.608555,0 days 00:02:31.572567,PCA,,65.0,,COMPLETE
95,95,0.8430513266674495,2023-01-15 17:24:15.645351,2023-01-15 17:26:47.062823,0 days 00:02:31.417472,PCA,,67.0,,COMPLETE
96,96,0.8390452282780609,2023-01-15 17:24:35.193653,2023-01-15 17:27:06.428845,0 days 00:02:31.235192,PCA,,67.0,,COMPLETE
97,97,0.8438205443849924,2023-01-15 17:24:53.715805,2023-01-15 17:27:25.445872,0 days 00:02:31.730067,PCA,,68.0,,COMPLETE
98,98,0.8514990084001763,2023-01-15 17:25:12.996699,2023-01-15 17:27:44.812530,0 days 00:02:31.815831,PCA,,69.0,,COMPLETE
99,99,0.8396924634142391,2023-01-15 17:25:32.888782,2023-01-15 17:28:03.768580,0 days 00:02:30.879798,PCA,,68.0,,COMPLETE
100,100,0.8405208402889052,2023-01-15 17:25:50.824297,2023-01-15 17:28:22.670383,0 days 00:02:31.846086,PCA,,67.0,,COMPLETE
101,101,0.8388082084022617,2023-01-15 17:26:09.583685,2023-01-15 17:28:41.268205,0 days 00:02:31.684520,PCA,,68.0,,COMPLETE
102,102,0.8473940510810678,2023-01-15 17:26:28.879986,2023-01-15 17:29:00.218013,0 days 00:02:31.338027,PCA,,69.0,,COMPLETE
103,103,0.8377312133171589,2023-01-15 17:26:47.695267,2023-01-15 17:29:19.289777,0 days 00:02:31.594510,PCA,,71.0,,COMPLETE
104,104,0.8437037670556471,2023-01-15 17:27:06.608859,2023-01-15 17:29:38.340311,0 days 00:02:31.731452,PCA,,69.0,,COMPLETE
105,105,0.8435134792354816,2023-01-15 17:27:25.659238,2023-01-15 17:29:57.257095,0 days 00:02:31.597857,PCA,,70.0,,COMPLETE
106,106,0.8470368686309218,2023-01-15 17:27:44.949178,2023-01-15 17:30:16.182756,0 days 00:02:31.233578,PCA,,70.0,,COMPLETE
107,107,0.8486155942996569,2023-01-15 17:28:04.557652,2023-01-15 17:30:35.211605,0 days 00:02:30.653953,PCA,,70.0,,COMPLETE
108,108,0.8442488074516994,2023-01-15 17:28:23.517601,2023-01-15 17:30:54.052140,0 days 00:02:30.534539,PCA,,70.0,,COMPLETE
109,109,0.846287021925027,2023-01-15 17:28:41.438966,2023-01-15 17:31:13.592075,0 days 00:02:32.153109,PCA,,73.0,,COMPLETE
110,110,0.8471886913242601,2023-01-15 17:29:00.432326,2023-01-15 17:31:33.358017,0 days 00:02:32.925691,PCA,,64.0,,COMPLETE
111,111,0.8367162545144871,2023-01-15 17:29:19.513670,2023-01-15 17:31:51.855024,0 days 00:02:32.341354,PCA,,86.0,,COMPLETE
112,112,0.8425313407692284,2023-01-15 17:29:38.550708,2023-01-15 17:32:11.248454,0 days 00:02:32.697746,PCA,,64.0,,COMPLETE
113,113,0.8335326141781056,2023-01-15 17:29:57.571835,2023-01-15 17:32:30.146336,0 days 00:02:32.574501,PCA,,85.0,,COMPLETE
114,114,0.8458827219937405,2023-01-15 17:30:16.454074,2023-01-15 17:32:49.069355,0 days 00:02:32.615281,PCA,,86.0,,COMPLETE
115,115,0.8456159115582595,2023-01-15 17:30:35.454024,2023-01-15 17:33:08.114318,0 days 00:02:32.660294,PCA,,64.0,,COMPLETE
116,116,0.8390050246211918,2023-01-15 17:30:54.237161,2023-01-15 17:33:27.273574,0 days 00:02:33.036413,PCA,,86.0,,COMPLETE
117,117,0.8436903623032499,2023-01-15 17:31:13.930604,2023-01-15 17:33:46.665808,0 days 00:02:32.735204,PCA,,64.0,,COMPLETE
118,118,0.8435554202229861,2023-01-15 17:31:33.532436,2023-01-15 17:34:05.930443,0 days 00:02:32.398007,PCA,,86.0,,COMPLETE
119,119,0.840265744400746,2023-01-15 17:31:52.385990,2023-01-15 17:34:24.582095,0 days 00:02:32.196105,PCA,,65.0,,COMPLETE
120,120,0.8445381943636994,2023-01-15 17:32:11.429049,2023-01-15 17:34:43.405207,0 days 00:02:31.976158,PCA,,73.0,,COMPLETE
121,121,0.8422811183425629,2023-01-15 17:32:30.426596,2023-01-15 17:35:02.485366,0 days 00:02:32.058770,PCA,,74.0,,COMPLETE
122,122,0.8403287228007794,2023-01-15 17:32:49.243977,2023-01-15 17:35:21.393244,0 days 00:02:32.149267,PCA,,75.0,,COMPLETE
123,123,0.8436236526231644,2023-01-15 17:33:08.654073,2023-01-15 17:35:40.582795,0 days 00:02:31.928722,PCA,,75.0,,COMPLETE
124,124,0.8414902320307414,2023-01-15 17:33:27.529288,2023-01-15 17:35:59.156876,0 days 00:02:31.627588,PCA,,75.0,,COMPLETE
125,125,0.8426342184462301,2023-01-15 17:33:46.855687,2023-01-15 17:36:18.142683,0 days 00:02:31.286996,PCA,,76.0,,COMPLETE
126,126,0.5016613577264813,2023-01-15 17:34:06.085450,2023-01-15 17:36:36.978193,0 days 00:02:30.892743,PCA,,2.0,,COMPLETE
127,127,0.84475507977637,2023-01-15 17:34:25.081304,2023-01-15 17:36:55.994888,0 days 00:02:30.913584,PCA,,75.0,,COMPLETE
128,128,0.8379648910395477,2023-01-15 17:34:43.608930,2023-01-15 17:37:15.189433,0 days 00:02:31.580503,PCA,,76.0,,COMPLETE
129,129,0.8372853828603206,2023-01-15 17:35:02.696782,2023-01-15 17:37:33.910888,0 days 00:02:31.214106,PCA,,76.0,,COMPLETE
130,130,0.8392203145994129,2023-01-15 17:35:21.612662,2023-01-15 17:37:53.107614,0 days 00:02:31.494952,PCA,,80.0,,COMPLETE
131,131,0.8291670106565407,2023-01-15 17:35:41.385449,2023-01-15 17:38:12.256957,0 days 00:02:30.871508,PCA,,26.0,,COMPLETE
132,132,0.8360866018899387,2023-01-15 17:35:59.364304,2023-01-15 17:38:30.916809,0 days 00:02:31.552505,PCA,,81.0,,COMPLETE
133,133,0.8289382339256086,2023-01-15 17:36:18.601242,2023-01-15 17:38:49.585458,0 days 00:02:30.984216,PCA,,29.0,,COMPLETE
134,134,0.8329063533665542,2023-01-15 17:36:37.375473,2023-01-15 17:39:08.918733,0 days 00:02:31.543260,PCA,,36.0,,COMPLETE
135,135,0.8391217432677575,2023-01-15 17:36:56.281421,2023-01-15 17:39:27.736313,0 days 00:02:31.454892,PCA,,80.0,,COMPLETE
136,136,0.8378789060928551,2023-01-15 17:37:15.390676,2023-01-15 17:39:47.162314,0 days 00:02:31.771638,PCA,,80.0,,COMPLETE
137,137,0.8424395799059651,2023-01-15 17:37:34.172792,2023-01-15 17:40:06.314816,0 days 00:02:32.142024,PCA,,80.0,,COMPLETE
138,138,0.8268760151702678,2023-01-15 17:37:53.337240,2023-01-15 17:40:25.636691,0 days 00:02:32.299451,PCA,,35.0,,COMPLETE
139,139,0.8398803600154109,2023-01-15 17:38:12.716338,2023-01-15 17:40:44.330494,0 days 00:02:31.614156,PCA,,59.0,,COMPLETE
140,140,0.8415724107807376,2023-01-15 17:38:31.152427,2023-01-15 17:41:03.556674,0 days 00:02:32.404247,PCA,,71.0,,COMPLETE
141,141,0.7957004105646495,2023-01-15 17:38:50.131968,2023-01-15 17:41:21.851759,0 days 00:02:31.719791,PCA,,10.0,,COMPLETE
142,142,0.8473408684079844,2023-01-15 17:39:09.068037,2023-01-15 17:41:41.172325,0 days 00:02:32.104288,PCA,,58.0,,COMPLETE
143,143,0.8402403022554132,2023-01-15 17:39:28.207044,2023-01-15 17:42:00.257995,0 days 00:02:32.050951,PCA,,59.0,,COMPLETE
144,144,0.7019550738349563,2023-01-15 17:39:47.549104,2023-01-15 17:42:25.662830,0 days 00:02:38.113726,LDA,5.0,,,COMPLETE
145,145,0.8422036004011069,2023-01-15 17:40:06.701611,2023-01-15 17:42:43.103765,0 days 00:02:36.402154,PCA,,60.0,,COMPLETE
146,146,0.8440173812067799,2023-01-15 17:40:26.261147,2023-01-15 17:43:02.011314,0 days 00:02:35.750167,PCA,,59.0,,COMPLETE
147,147,0.8487037544616058,2023-01-15 17:40:44.886000,2023-01-15 17:43:21.412589,0 days 00:02:36.526589,PCA,,72.0,,COMPLETE
148,148,0.8397252635205961,2023-01-15 17:41:03.839117,2023-01-15 17:43:40.521923,0 days 00:02:36.682806,PCA,,61.0,,COMPLETE
149,149,0.7019550738349563,2023-01-15 17:41:22.330320,2023-01-15 17:44:06.687492,0 days 00:02:44.357172,LDA,5.0,,,COMPLETE
150,150,0.7019550738349563,2023-01-15 17:41:41.351140,2023-01-15 17:44:30.026015,0 days 00:02:48.674875,LDA,5.0,,,COMPLETE
151,151,0.7019550738349563,2023-01-15 17:42:00.447817,2023-01-15 17:44:55.167344,0 days 00:02:54.719527,LDA,5.0,,,COMPLETE
152,152,0.8438139048618514,2023-01-15 17:42:25.924294,2023-01-15 17:45:13.821163,0 days 00:02:47.896869,PCA,,66.0,,COMPLETE
153,153,0.8424236543959429,2023-01-15 17:42:43.613728,2023-01-15 17:45:33.173111,0 days 00:02:49.559383,PCA,,66.0,,COMPLETE
154,154,0.8428172336723438,2023-01-15 17:43:02.847544,2023-01-15 17:45:52.131269,0 days 00:02:49.283725,PCA,,66.0,,COMPLETE
155,155,0.8432578794033807,2023-01-15 17:43:21.774362,2023-01-15 17:46:11.223491,0 days 00:02:49.449129,PCA,,62.0,,COMPLETE
156,156,0.8443096924446447,2023-01-15 17:43:40.717837,2023-01-15 17:46:29.796188,0 days 00:02:49.078351,PCA,,65.0,,COMPLETE
157,157,0.8418868226931628,2023-01-15 17:44:07.423824,2023-01-15 17:46:48.852075,0 days 00:02:41.428251,PCA,,65.0,,COMPLETE
158,158,0.8430554631169569,2023-01-15 17:44:30.183324,2023-01-15 17:47:07.847217,0 days 00:02:37.663893,PCA,,72.0,,COMPLETE
159,159,0.8476366508419249,2023-01-15 17:44:55.691848,2023-01-15 17:47:27.660076,0 days 00:02:31.968228,PCA,,65.0,,COMPLETE
160,160,0.8430648782516089,2023-01-15 17:45:14.056673,2023-01-15 17:47:45.937243,0 days 00:02:31.880570,PCA,,71.0,,COMPLETE
161,161,0.8473643780971564,2023-01-15 17:45:33.376193,2023-01-15 17:48:05.264993,0 days 00:02:31.888800,PCA,,71.0,,COMPLETE
162,162,0.8456166215778531,2023-01-15 17:45:52.337117,2023-01-15 17:48:24.456993,0 days 00:02:32.119876,PCA,,72.0,,COMPLETE
163,163,0.8411127296036158,2023-01-15 17:46:11.411188,2023-01-15 17:48:43.841392,0 days 00:02:32.430204,PCA,,71.0,,COMPLETE
164,164,0.8438610975125466,2023-01-15 17:46:30.027589,2023-01-15 17:49:02.742593,0 days 00:02:32.715004,PCA,,69.0,,COMPLETE
165,165,0.8415997873567905,2023-01-15 17:46:49.433598,2023-01-15 17:49:21.653277,0 days 00:02:32.219679,PCA,,71.0,,COMPLETE
166,166,0.8438186038992134,2023-01-15 17:47:08.216004,2023-01-15 17:49:40.739606,0 days 00:02:32.523602,PCA,,69.0,,COMPLETE
167,167,0.8452948341386556,2023-01-15 17:47:28.439996,2023-01-15 17:50:00.198786,0 days 00:02:31.758790,PCA,,70.0,,COMPLETE
168,168,0.8406088229151631,2023-01-15 17:47:46.382249,2023-01-15 17:50:18.961824,0 days 00:02:32.579575,PCA,,70.0,,COMPLETE
169,169,0.8402623078073544,2023-01-15 17:48:05.542506,2023-01-15 17:50:38.150006,0 days 00:02:32.607500,PCA,,69.0,,COMPLETE
170,170,0.8427698777228191,2023-01-15 17:48:24.650904,2023-01-15 17:50:56.793086,0 days 00:02:32.142182,PCA,,69.0,,COMPLETE
171,171,0.8411916390990406,2023-01-15 17:48:44.013548,2023-01-15 17:51:15.938768,0 days 00:02:31.925220,PCA,,69.0,,COMPLETE
172,172,0.8325705136777792,2023-01-15 17:49:03.032463,2023-01-15 17:51:35.099001,0 days 00:02:32.066538,PCA,,70.0,,COMPLETE
173,173,0.8334226099078246,2023-01-15 17:49:22.433114,2023-01-15 17:51:53.946061,0 days 00:02:31.512947,PCA,,84.0,,COMPLETE
174,174,0.8479529713762087,2023-01-15 17:49:40.962622,2023-01-15 17:52:12.595544,0 days 00:02:31.632922,PCA,,84.0,,COMPLETE
175,175,0.8412298582479183,2023-01-15 17:50:00.341224,2023-01-15 17:52:31.851695,0 days 00:02:31.510471,PCA,,78.0,,COMPLETE
176,176,0.8445672453926962,2023-01-15 17:50:19.368526,2023-01-15 17:52:51.012068,0 days 00:02:31.643542,PCA,,89.0,,COMPLETE
177,177,0.8487993184652964,2023-01-15 17:50:38.325013,2023-01-15 17:53:09.528151,0 days 00:02:31.203138,PCA,,73.0,,COMPLETE
178,178,0.8458465939193767,2023-01-15 17:50:57.236150,2023-01-15 17:53:29.086310,0 days 00:02:31.850160,PCA,,73.0,,COMPLETE
179,179,0.8416147406085809,2023-01-15 17:51:16.698733,2023-01-15 17:53:48.148075,0 days 00:02:31.449342,PCA,,73.0,,COMPLETE
